title,title-en,category,region,position,website,address,desc-fr,desc-en,wiki-fr,wiki-en,popularity,credit-desc-fr,credit-desc-en
Le Centre Pompidou,Centre Pompidou,museum,iledefrance,"[48.860642,2.35224500000004]",www.centrepompidou.fr,"Place Georges-Pompidou, 75004 Paris","Le centre national d’art et de culture Georges-Pompidou (CNAC) – communément appelé « centre Georges-Pompidou », « centre Pompidou » ou « centre Beaubourg », et familièrement « Beaubourg » – est un établissement polyculturel né de la volonté du président Georges Pompidou, grand amateur d'art moderne, de créer au cœur de Paris une institution culturelle originale entièrement vouée à la création moderne et contemporaine où les arts plastiques voisineraient avec les livres, le dessin, la musique ainsi que le cinéma.
Il est situé dans le quartier Saint-Merri, à Paris 4e, entre le quartier des Halles, à l'ouest, et le Marais, à l'est.
Il emploie un millier de personnes et a un budget annuel de cent millions d'euros dont soixante-cinq millions de subventions de l'État.
Inauguré le 31 janvier 1977, le centre Pompidou a accueilli, en 2016, plus de 3,3 millions de visiteurs (plus de 8,2 millions en 2013). Au sein du musée national d'Art moderne / centre de création industrielle (MNAM / CCI), il conserve l'une des trois plus importantes collections d'art moderne et contemporain au monde avec celle du Museum of Modern Art (MoMA) de New York et de la Tate Modern de Londres, et la première d'Europe avec 100 313 œuvres de 6 396 artistes au 1er janvier 2014.
Il abrite également d'importantes galeries d'expositions temporaires, des salles de spectacles et de cinéma, et la BPI, première bibliothèque publique de lecture en Europe. De part et d'autre de la piazza, deux bâtiments annexes accueillent l'IRCAM et l'atelier Brancusi.
Depuis le 12 mai 2010, la ville de Metz est dotée d'une antenne décentralisée du centre, le centre Pompidou-Metz. Entre octobre 2011 et septembre 2013, le centre Pompidou lance une annexe mobile qui se déplace entre les villes de Chaumont, Cambrai, Boulogne-sur-Mer, Libourne, Le Havre et Aubagne. En mars 2015, le centre Pompidou de Malaga, premier « centre Pompidou provisoire » situé à l'étranger, sera accueilli pour cinq ans renouvelables sur 6 300 m2 par « El Cubo » de Málaga en Andalousie, où seront présentées soixante-dix œuvres du musée contre un montant d'un million d'euros par an.
Le centre Pompidou s’est associé à la région de Bruxelles-Capitale pour créer dans la capitale belge, Bruxelles, en 2020, un musée consacré à l’art moderne et contemporain ainsi qu'à l'architecture moderne et contemporaine. Cet espace de 30 000 m2 occupera un vaste et lumineux bâtiment Art déco de quatre étages qui abrite depuis les années 1930 un garage Citroën, racheté par la région bruxelloise, qui ne dispose pas de pôle culturel emblématique consacré à l'art contemporain, pour 20,5 millions d'euros au constructeur automobile français. Le centre Pompidou mettra une partie de ses collections d'environ 120 000 œuvres, dont seuls 10 % sont montrées au public, à la disposition du futur musée. Le nom du musée n'a pas encore été fixé mais « centre Pompidou » devrait figurer dans la future appellation,,.
Une autre antenne ouvre à Shangai en 2019, le Centre Pompidou West Bund Museum.","The Centre Pompidou (French pronunciation: ​[sɑ̃tʁ pɔ̃pidu]), also known as the Pompidou Centre in English, is a complex building in the Beaubourg area of the 4th arrondissement of Paris, near Les Halles, rue Montorgueil, and the Marais. It was designed in the style of high-tech architecture by the architectural team of Richard Rogers and Renzo Piano, along with Gianfranco Franchini.
It houses the Bibliothèque publique d'information (Public Information Library), a vast public library; the Musée National d'Art Moderne, which is the largest museum for modern art in Europe; and IRCAM, a centre for music and acoustic research. Because of its location, the Centre is known locally as Beaubourg (IPA: [bobuʁ]). It is named after Georges Pompidou, the President of France from 1969 to 1974 who commissioned the building, and was officially opened on 31 January 1977 by President Valéry Giscard d'Estaing. As of 2006, the Centre Pompidou has had over 180 million visitors since 1977 and more than 5,209,678 visitors in 2013, including 3,746,899 for the museum.The sculpture Horizontal by Alexander Calder, a free-standing mobile that is 7.6 m (25 ft) tall, was placed in front of the Centre Pompidou in 2012.",77267,53889,1,Wikipédia : Centre national d'art et de culture Georges-Pompidou,Wikipédia : Centre Pompidou
Disneyland Parc,Disneyland Paris,city,iledefrance,"[48.8726382,2.77678070000002]",www.disneylandparis.com,"Boulevard de Parc, 77700 Chessy","Disneyland Paris, anciennement Euro Disney Resort et Disneyland Resort Paris, est un complexe touristique et urbain de 22,30 km2 (2 230 ha) situé en sa majeure partie dans la commune de Chessy (Seine-et-Marne), à trente-deux kilomètres à l'est de Paris. Le complexe touristique comprend deux parcs à thèmes – le parc Disneyland et le parc Walt Disney Studios – ainsi que 7 hôtels et un golf, tandis que le complexe urbain intensifie le tissu du secteur IV de Marne-la-Vallée au travers de Val d'Europe Agglomération. Le site est favorisé par de nombreux transports, dont le prolongement de la ligne A du RER d'Île-de-France en service depuis le 1er avril 1992 et financé par la région, des infrastructures routières comme la bretelle de liaison avec l'autoroute A4, ainsi qu'une gare TGV subventionnée par l'État français et inaugurée le 29 mai 1994 qui relie le complexe aux principales villes françaises et européennes.
Le complexe est exploité par le groupe Euro Disney, coté en bourse de Paris de 1989 à 2017, date du rachat de 97,08 % des parts par la Walt Disney Company et par conséquent de son retrait de la cote. Sa directrice est Natacha Rafalski depuis le 12 décembre 2018, remplaçant Catherine Powell. En 2016, le chiffre d'affaires effectue une légère baisse, puisqu'il s'établit à 1,28 milliard d'euros, contre 1,3 milliard en 2014. Cette même année, l'ensemble du complexe compte plus de 320 millions de visiteurs depuis son ouverture, en 1992. Avec plus de 20 langues parlées et plus de 100 nationalités différentes, les 16 500 cast-members (=employés) font de Disneyland Paris le premier employeur mono-site de France et le premier employeur privé de Seine-et-Marne.","Disneyland Paris, formerly Euro Disney Resort, is an entertainment resort in Chessy, France, a new town located 32 km (20 mi) east of the centre of Paris. It encompasses two theme parks, many resort hotels, Disney Nature Resorts, a shopping, dining, and entertainment complex, and a golf course, in addition to several additional recreational and entertainment venues. Disneyland Park is the original theme park of the complex, opening with the resort on 12 April 1992. A second theme park, Walt Disney Studios Park, opened in 2002, 10 years after the original park. Disneyland Paris celebrated its 25th anniversary in 2017. Within 25 years of opening, 320 million people visited Disneyland Paris, making it the most visited theme park in Europe. The Parisian resort is the second Disney park to open outside the United States following the opening of the Tokyo Disney Resort in 1983 and is the largest Disney resort to open outside of the United States. Disneyland Paris is also the only Disney resort outside of the United States to be completely owned by The Walt Disney Company.

",231112,76286,3,Wikipédia : Disneyland Paris,Wikipédia : Disneyland Paris
Château de Versailles,Palace of Versailles,historical,iledefrance,"[48.8048649,2.12035539999999]",www.chateauversailles.fr,"Place d'Armes, 78000 Versailles","Le château de Versailles est un château et un monument historique français qui se situe à Versailles, dans les Yvelines, en France. Il fut la résidence des rois de France Louis XIV, Louis XV et Louis XVI. Le roi et la cour y résidèrent de façon permanente du 6 mai 1682 au 6 octobre 1789, à l'exception des années de la Régence de 1715 à 1723.
Situés au sud-ouest de Paris, ce château et son domaine visaient à glorifier la monarchie française.
Le château est constitué d'une succession d'éléments ayant une harmonie architecturale. Il s'étale sur 63 154 m2, répartis en 2 300 pièces, dont, actuellement, 1 000 pièces de musée.
Le parc du château de Versailles s'étend sur 815 ha, contre environ 8 000 ha avant la Révolution française, dont 93 ha de jardins. Il comprend de nombreux éléments, dont le Petit et le Grand Trianon (qui fut également résidence de Napoléon Ier, Louis XVIII, Charles X, Louis-Philippe Ier, et Napoléon III), le hameau de la Reine, le Grand et le Petit Canal, une ménagerie (aujourd’hui détruite), une orangerie et la pièce d'eau des Suisses.","The Palace of Versailles ( vair-SY, vur-SY; French: Château de Versailles [ʃɑto d(ə) vɛʁsɑj] (listen)) was the principal royal residence of France from 1682, under Louis XIV, until the start of the French Revolution in 1789, under Louis XVI. It is located in the department of Yvelines, in the region of Île-de-France, about 20 kilometres (12 miles) southwest of the centre of Paris.The palace is now an historical monument and UNESCO World Heritage site, notable especially for the ceremonial Hall of Mirrors, the jewel-like Royal Opera, and the royal apartments; for the more intimate royal residences, the Grand Trianon and Petit Trianon located within the park; the small rustic Hameau (Hamlet) created for Marie Antoinette; and the vast Gardens of Versailles with fountains, canals, and geometric flower beds and groves, laid out by André le Nôtre. The Palace was stripped of all its furnishings after the French Revolution, but many pieces have been returned and many of the palace rooms have been restored.
In 2017 the Palace of Versailles received 7,700,000 visitors, making it the second-most visited monument in the Île-de-France region, just behind the Louvre and ahead of the Eiffel Tower.",57821,53316,3,Wikipédia : Château de Versailles,Wikipédia : Palace of Versailles
Canal Saint-Martin,Canal Saint-Martin,historical,iledefrance,"[48.8689413,2.3671276]",,"35 Quai de Jemmapes, 75010 Paris","Le canal Saint-Martin est un canal de 4,55 km de long situé essentiellement dans les 10e et 11e arrondissements de Paris. Il relie le bassin de la Villette — et au-delà le canal de l'Ourcq — au port de l'Arsenal (le port de plaisance de Paris) qui communique avec la Seine. C'est un canal de petit gabarit destiné, à l'origine, à l'adduction d'eau potable dans la capitale. Inauguré en 1825, il comporte neuf écluses et deux ponts tournants pour une dénivellation totale de 25 m.
Avec le canal de l'Ourcq, le bassin de la Villette et le canal Saint-Denis, il constitue le réseau des canaux parisiens, long de 130 km, qui appartient à la Ville de Paris. Le canal Saint-Martin est inscrit monument historique depuis le 23 février 1993.
Ce site est desservi par les stations de métro Bastille, Bréguet - Sabin, Richard-Lenoir, Oberkampf, République, Goncourt, Jacques Bonsergent, Gare de l'Est, Château-Landon, Colonel Fabien, Louis Blanc et Jaurès.","The Canal Saint-Martin is a 4.6 km (2.86 mi) long canal in Paris, connecting the Canal de l'Ourcq to the river Seine. Over nearly half its length (2069 m), between the Rue du Faubourg du Temple and the Place de la Bastille, it was covered, in the mid-19th century, to create wide boulevards and public spaces on the surface. The canal is drained and cleaned every 10–15 years, and it is always a source of fascination for Parisians to discover curiosities and even some treasures among the hundreds of tonnes of discarded objects.",141398,922895,1,Wikipédia : Canal Saint-Martin,Wikipédia : Canal Saint-Martin
Pointe du Grouin,Pointe du Grouin,nature,bassenormandie,"[48.6549985,-1.44538469999998]",,50300 Vains,"La pointe du Grouin est la pointe la plus au nord de Cancale qui offre une vue inédite sur la partie sud du Mont Saint-Michel. Dans son prolongement se trouve le Phare de la Pierre-de-Herpin. Ce site de la Côte d'Émeraude accueille entre 600 000 et un million de visiteurs, les années de Route du Rhum dont la pointe sert à tracer la ligne de départ.
Cette pointe rocheuse et sauvage domine la mer de 40 mètres. Le panorama s'étend du cap Fréhel à Granville en passant par la baie du Mont Saint-Michel, au large des îles Chausey. Un sentier, le GR 34, permet d'aller à marée basse explorer une grotte creusée dans la falaise. 
L'île des Landes, qui est en face, constitue une réserve ornithologique et botanique.","The rocky finger of the Pointe du Grouin points out and protects the entrance into the bay of Mont Saint-Michel.
On this headland, a Grande Randonnée footpath runs around hugging the cliff face and there is a circular walk starting out from Cancale.
On their way the walker can enjoy views of the Île des Landes a long barren outcrop (now a bird sanctuary), the lighthouse, the Îles Chausey, Granville on the Normandy coast, and, on a clear day, the outline of Mont Saint-Michel.",1269851,3226675,1,Wikipédia : Pointe du Grouin,Wikipédia : Pointe du Grouin
Canal du Midi,Canal du Midi,nature,languedoc,"[43.2427146,2.4054572]",,Canal du Midi,"Le canal du Midi est un canal de navigation français à bief de partage qui relie Toulouse à la mer Méditerranée depuis le xviie siècle. D'abord nommé « canal royal de Languedoc », les révolutionnaires le rebaptisent en 1789 « canal du Midi ». À partir du xixe siècle, le canal latéral à la Garonne, qui double la Garonne de Bordeaux à Toulouse, prolonge le canal du Midi pour fournir une voie navigable de l'océan Atlantique à la mer Méditerranée : l'ensemble des deux canaux est dénommé « canal des Deux-Mers ».
Ouvrage d'art exceptionnel, considéré par ses contemporains comme le plus grand chantier du XVIIe siècle, le canal du Midi révolutionne le transport fluvial et la circulation dans le Midi de la France de l'Ancien Régime. Le défi, relevé par Pierre-Paul Riquet, son concepteur, est d'acheminer l'eau de la montagne Noire jusqu'au seuil de Naurouze, le point le plus élevé du canal. Louis XIV autorise le début des travaux par un édit royal d'octobre 1666. Supervisé par Pierre-Paul Riquet, le chantier dure de 1666 à 1681, sous le contrôle de Jean-Baptiste Colbert. 
Le canal du Midi est l'un des plus anciens canaux d'Europe toujours en fonctionnement. Depuis 1996, il est inscrit sur la liste du patrimoine mondial de l'UNESCO.
En 2007, la station de métro de la ligne B du métro de Toulouse porte son nom.","The Canal du Midi (French pronunciation: ​[kanal dy midi]; Occitan: Canal de las Doas Mars, meaning canal of the two seas) is a 240 km (150 mi) long canal in Southern France (French: le Midi). Originally named the Canal royal en Languedoc (Royal Canal in Languedoc) and renamed by French revolutionaries to Canal du Midi in 1789, the canal was at the time considered one of the greatest construction works of the 17th century.The canal connects the Garonne to the Étang de Thau on the Mediterranean and along with the 193 km (120 mi) long Canal de Garonne forms the Canal des Deux Mers, joining the Atlantic to the Mediterranean. The canal runs from the city of Toulouse down to the Étang de Thau near the Mediterranean.
Strictly speaking, ""Canal du Midi"" refers to the portion initially constructed from Toulouse to the Mediterranean – the Deux-Mers canal project aimed to link together several sections of navigable waterways to join the Mediterranean and the Atlantic: first the Canal du Midi, then the Garonne which was more or less navigable between Toulouse and Bordeaux, then the Garonne Lateral Canal built later, and finally the Gironde estuary after Bordeaux.
Jean-Baptiste Colbert authorized the start of work by royal edict in October, 1666, with the aim of developing the wheat trade, under the supervision of Pierre-Paul Riquet, and construction lasted from 1666 to 1681, during the reign of Louis XIV. The Canal du Midi is one of the oldest canals of Europe still in operation (the prototype being the Briare Canal). The challenges in these works are closely related to the challenges of inland water transport today. The key challenge, raised by Pierre-Paul Riquet, was to convey water from the Montagne Noire (Black Mountains) to the Seuil de Naurouze, the highest point of the canal.
The Canal du Midi was inscribed as a UNESCO World Heritage Site in 1996.",8079,189457,1,Wikipédia : Canal du Midi,Wikipédia : Canal du Midi
Loches,Loches,city,centre,"[47.128158,0.997663999999986]",,37600 Loches,"Loches est une commune française située dans le département d'Indre-et-Loire, en région Centre-Val de Loire.
Chef-lieu d'arrondissement et sous-préfecture d'Indre-et-Loire, cette petite ville de Touraine, située sur l'Indre, forme une agglomération de dix mille habitants avec les communes de Beaulieu-lès-Loches, Ferrière-sur-Beaulieu et Perrusson.","Loches (French pronunciation: ​[lɔʃ]) is a commune in the Indre-et-Loire department in central France.
It is situated 29 miles (47 km) southeast of Tours by railway, on the left bank of the Indre River.",30851,2960797,1,Wikipédia : Loches,Wikipédia : Loches
Grotte Aven Armand,Aven Armand,museum,languedoc,"[44.222505,3.35564799999997]",https://www.aven-armand.com/,"Aven Armand, 48150 Hures-la-Parade","L'aven Armand est une cavité souterraine naturelle située sous le causse Méjean en Lozère, entre Meyrueis et Sainte-Enimie sur le territoire de la commune de Hures-la-Parade. Un aménagement comprenant notamment une entrée artificielle et un funiculaire facilite la visite touristique de cette cavité réputée pour sa « forêt de stalagmites ».","Aven Armand is a limestone cave located in the Cévennes National Park of France, in the Lozère département, between Meyrueis and Sainte-Enimie.",221474,3778225,1,Wikipédia : Aven Armand,Wikipédia : Aven Armand
Hôtel des Invalides,Les Invalides,historical,iledefrance,"[48.856529,2.31270589999997]",www.musee-armee.fr,"129 Rue de Grenelle, 75007 Paris","L’hôtel des Invalides est un monument parisien dont la construction fut ordonnée par Louis XIV par l'édit royal du 24 février 1670, pour abriter les invalides de ses armées. Aujourd'hui, il accueille toujours des invalides, mais également la cathédrale Saint-Louis des Invalides, plusieurs musées et une nécropole militaire avec notamment le tombeau de Napoléon Ier. C'est aussi le siège de hautes autorités militaires, comme le chef d'état-major de l'armée de Terre ou le gouverneur militaire de Paris, et rassemble beaucoup d'organismes dédiés à la mémoire des anciens combattants ou le soutien aux soldats blessés.
Cet immense complexe architectural, conçu par Libéral Bruand et Jules Hardouin-Mansart, est un des chefs-d’œuvre les plus importants de l'architecture classique française.
Ce site est desservi par les stations de métro Invalides, Varenne et La Tour-Maubourg. Avant 1860, il était situé dans le 10e arrondissement « ancien » d'où l'enregistrement du décès des militaires dans l'« état civil reconstitué » de la capitale qu'on peut trouver dans différentes bases de données.","Les Invalides (French pronunciation: ​[lezɛ̃valid]), formally the Hôtel national des Invalides (The National Residence of the Invalids), or also as Hôtel des Invalides, is a complex of buildings in the 7th arrondissement of Paris, France, containing museums and monuments, all relating to the military history of France, as well as a hospital and a retirement home for war veterans, the building's original purpose. The buildings house the Musée de l'Armée, the military museum of the Army of France, the Musée des Plans-Reliefs, and the Musée d'Histoire Contemporaine, as well as the Dôme des Invalides, a large church, the tallest in Paris at a height of 107 meters, with the tombs of some of France's war heroes, most notably Napoleon.",75747,62633,1,Wikipédia : Hôtel des Invalides,Wikipédia : Les Invalides
Le Bois des Moutiers,Bois des Moutiers,nature,hautenormandie,"[49.9117958,0.983238099999994]",www.boisdesmoutiers.com,"Route de l'Eglise, 76119 Varengeville-sur-Mer","Le bois des Moutiers se situe en France sur la commune de Varengeville-sur-Mer, dans le département de la Seine-Maritime en région Normandie.
Ce domaine de 12 hectares fut aménagé de façon que la nature organisée et la végétation sauvage se côtoient. Rhododendrons, azalées et magnolias, pour lesquels le bois des Moutiers est entre autres réputé, furent importés et naturalisés au milieu de la flore locale.
Le bois des Moutiers est composé de trois parties : des jardins aménagés de style anglais, un vaste parc qui donne sur la mer et un manoir, toujours habité par la famille. 
Le domaine est labellisé  Jardin remarquable initialement en 2004.
Après une inscription à l'Inventaire Supplémentaire  des Monuments historiques en 1975, l'ensemble du domaine fait l’objet d’un classement au titre des monuments historiques depuis le 11 décembre 2008.
Le bois des Moutiers est préservé depuis 24 ans par l'arrière-petit-fils de Guillaume Mallet, Antoine Bouchayer-Mallet, qui, architecte DPLG, artiste et gestionnaire du site, souhaite le sauvegarder pour les générations futures.","The Bois des Moutiers is located in Varengeville-sur-Mer, Normandy, France. This estate of 30 acres (0.12 km2) is well known for its rhododendrons, azaleas and magnolias, which were introduced and naturalized among local flora. The house and gardens, both dating from the turn of the 19th and 20th centuries, are a first-class example, unique in France, of the work of the famous English partnership of architect Edwin Lutyens and garden designer Gertrude Jekyll.
A large park overlooking the sea and formal gardens surrounding a manor house, where the original owner's descendants still live, make up the Bois des Moutiers. The estate is listed as a historical monument and a Remarkable Garden of France.",4594635,26602093,1,Wikipédia : Bois des Moutiers,Wikipédia : Bois des Moutiers
Parc national des Cévennes,Cévennes National Park,nature,languedoc,"[44.2641552,3.71220360000007]",www.cevennes-parcnational.fr,,"Le parc national des Cévennes est un parc national français créé le 2 septembre 1970, couvrant la région naturelle des Cévennes et situé principalement dans les départements de la Lozère, du Gard et de l'Ardèche. Il s'étend donc sur deux régions : l'Occitanie et l'Auvergne-Rhône-Alpes. Son siège se trouve au château de Florac.
Le parc national des Cévennes présente plusieurs particularités qui le distinguent des autres parcs nationaux français : il est le seul à être situé en moyenne montagne et, avec le Parc national de forêts, le seul de métropole dont le cœur est habité et exploité par des résidents permanents (agriculture et chasse). 
Son coeur est classé comme aire protégée de catégorie II par la Commission mondiale des aires protégées de l'Union internationale pour la conservation de la nature.
Le parc est également reconnu réserve de biosphère par l'Unesco depuis 1985.","The Cévennes National Park (French: Parc national des Cévennes) is a national park located in southern France, in the mountainous area of Cévennes.
Created in 1970, the park has its administrative seat in Florac at Florac Castle. It is located mainly in the départements of Lozère and Gard, and covers some parts of Ardèche and Aveyron. The Aven Armand cave is located in the park. In 2011, the Park was made a part of The Causses and the Cévennes, Mediterranean agro-pastoral Cultural Landscape UNESCO World Heritage site.",96381,443062,1,Wikipédia : Parc national des Cévennes,Wikipédia : Cévennes National Park
Cité de Carcassonne,Cité de Carcassonne,historical,languedoc,"[43.2060816,2.36419609999996]",www.remparts-carcassonne.fr,"1 Rue Viollet le Duc, 11000 Carcassonne","La Cité de Carcassonne est un ensemble architectural médiéval qui se trouve dans la ville française de Carcassonne dans le département de l'Aude, région d'Occitanie. Elle est située sur la rive droite de l'Aude, au sud-est de la ville actuelle. Cette cité médiévale fortifiée, dont les origines remontent à la période gallo-romaine, doit sa renommée à sa double enceinte, atteignant près de 3 km de longueur et comportant cinquante-deux tours, qui domine la vallée de l'Aude. La Cité comprend également un château (le château comtal) et une basilique (la basilique Saint-Nazaire).
Sauvée de la destruction par l'action et la ténacité de l'archéologue Jean-Pierre Cros-Mayrevieille, puis restaurée au XIXe siècle de manière parfois controversée sous la direction de Viollet-le-Duc puis de Boeswillwald, la Cité de Carcassonne est, depuis 1997, classée au patrimoine mondial de l'UNESCO. Le château comtal, les fortifications, et les tours appartiennent à l'État et sont gérés par le Centre des monuments nationaux, tandis que les lices et le reste de la Cité font partie du domaine municipal.","The Cité de Carcassonne (Occitan: Ciutat de Carcassona [siwˈtad de kaɾkaˈsunɔ]) is a medieval citadel located in the French city of Carcassonne, in the department of Aude, Occitanie region. It is located on a hill on the right bank of the River Aude, in the south-east part of the city proper.",130489,31673601,3,Wikipédia : Cité de Carcassonne,Wikipédia : Cité de Carcassonne
