title,title-en,category,region,position,website,address,desc-fr,desc-en,wiki-fr,wiki-en,popularity,credit-desc-fr,credit-desc-en
Calvi,"Calvi, Haute-Corse",city,corse,"[42.567651,8.75722199999996]",,20260 Calvi,"Calvi est une commune française située dans la circonscription départementale de la Haute-Corse et le territoire de la collectivité de Corse. Bâtie dans le golfe du même nom, elle se trouve au nord-ouest de l'île et constitue avec l'Île-Rousse l'une des deux agglomérations majeures de Balagne.","Calvi (French: [kalvi], Corsican: [ˈkalvi]) is a commune in the Haute-Corse department of France on the island of Corsica.
It is the seat of the Canton of Calvi, which contains Calvi and one other commune, Lumio. Calvi is also the capital of the Arrondissement of Calvi, which contains, besides the Canton of Calvi, three other cantons: L'Île-Rousse, Belgodère, and Calenzana.The 2nd Foreign Parachute Regiment (2ème REP) of the French Foreign Legion is based in the citadel of Calvi.According to legend, Christopher Columbus supposedly came from Calvi, which at the time was part of the Genoese Empire. Because the often subversive elements of the island gave its inhabitants a bad reputation, he would have been expected to mask his exact birthplace.",105455,1390093,1,Wikipédia : Calvi,"Wikipédia : Calvi, Haute-Corse"
Vogüé,Vogüé,city,rhone,"[44.551115,4.41329300000007]",,07200 Vogüé,"Vogüé est une commune française, située dans le département de l'Ardèche en région Auvergne-Rhône-Alpes. Ses habitants sont appelés les Voguéens.",Vogüé is a commune in the Ardèche department in southern France.,323512,12942104,1,Wikipédia : Vogüé,Wikipédia : Vogüé
Fête Des Lumières,Festival of Lights,event,rhone,"[45.7577553,4.83355890000007]",www.fetedeslumieres.lyon.fr,69002 Lyon,"La Fête des Lumières est une manifestation populaire qui se tient à Lyon (France) le soir du 8 décembre, date à laquelle est célébrée l'Immaculée-Conception de la Vierge Marie.
La Fête de la lumière est l'évènement principal de Chartres en lumières, qui a lieu mi-septembre.
Le Festival of Lights, manifestation culturelle annuelle de Berlin (Allemagne).
Le Brussels Light Festival, la fête des lumières de Bruxelles, est une manifestation populaire qui a lieu aux alentours du 1er novembre durant 4 jours.
La fête des lumières est un nom donné à la fête juive de Hanoucca.
En Inde, Divālī est une fête des lumières très populaire, qui doit son nom aux lampes dīp (ou diya) allumées en l'honneur du retour de Rama à Ayodhya (voir Ramayana).
La fête persane de Chaharshanbeh suri est souvent appelée Fête du feu, Fête des lumières ou Mercredi rouge.
En Thaïlande, Loi Krathong est aussi une fête des lumières.",Festival of Lights or Celebration of Light may refer to:,2487080,2878072,1,Wikipédia : Fête des lumières,Wikipédia : Festival of Lights
Sant'Antonino,"Sant'Antonino, Haute-Corse",city,corse,"[42.589356,8.90502900000001]",,20220 Sant'Antonino,"Sant'Antonino est une commune française située dans la circonscription départementale de la Haute-Corse et le territoire de la collectivité de Corse. Le village appartient à la piève d'Aregno, en Balagne.",Sant'Antonino (French pronunciation: ​[sɑ̃.t‿ɑ̃tɔnino]) is a commune in the Haute-Corse department of France on the island of Corsica. It is one of Les Plus Beaux Villages de France.,453185,15539478,1,Wikipédia : Sant'Antonino (Haute-Corse),"Wikipédia : Sant'Antonino, Haute-Corse"
Musée de Grenoble,Museum of Grenoble,museum,rhone,"[45.194928,5.73231290000001]",www.museedegrenoble.fr,"5 Place de Lavalette, 38000 Grenoble","Le musée de Grenoble, appelé musée de Peinture et de Sculpture de Grenoble jusque dans les années 1980, a été créé le 16 février 1798 par le professeur de dessin Louis-Joseph Jay. Principal musée d'art et d'antiquités de la ville de Grenoble, il est situé place Lavalette, à l'emplacement d'un ancien couvent des Franciscains édifié en 1218 et dont le site deviendra militaire à la fin du XVIe siècle. Il fait partie des premiers musées d'art français et conserve l'une des plus belles collections d'art ancien.
Réparties sur 57 salles d'expositions permanentes ainsi qu'un vaste jardin de sculptures, la plupart des disciplines artistiques y sont représentées et ses collections embrassent une période comprise entre l’Égypte antique et l’art contemporain. Cependant, grâce à l'action de l'un de ses conservateurs de l'entre-deux-guerres, il est considéré comme le tout premier musée d'art moderne en France,,. Par ailleurs, ses salles d'expositions temporaires lui permettent d'accueillir des expositions dépassant pour certaines la barre des 100 000 visiteurs, faisant du lieu un pôle important de la vie artistique française. Il possède également la particularité architecturale d'avoir deux bâtiments construits à près de six siècles d'intervalle.
Parmi ses pièces les plus célèbres figurent le Saint Grégoire pape, entouré de saints et de saintes de Rubens, les quatre grands tableaux du peintre espagnol Francisco de Zurbarán, l'Intérieur aux aubergines d'Henri Matisse, le portrait de Jackie Kennedy par Andy Warhol ou le premier tableau de Pablo Picasso a entrer dans les collections publiques françaises en 1921.","The Museum of Grenoble (French: Musée de Grenoble) is a municipal museum of Fine Arts and antiquities in the city of Grenoble in the Isère region of France.
Located on the left bank of the Isère River, place Lavalette, it is known both for its collections of ancient art for its collections of modern and contemporary art. Thanks to the action of one of its curators of the interwar period (Andry-Farcy), it is considered the very first museum of modern art in France.Its temporary rooms allow it to organize two exhibitions each year.",1571884,25523606,1,Wikipédia : Musée de Grenoble,Wikipédia : Museum of Grenoble
Les Calanques de Piana,Calanques de Piana,nature,corse,"[42.2454527,8.65347689999999]",,20115 Piana,"Les calanques de Piana (en langue corse calanche di Piana, au singulier calanca) sont situées sur la côte ouest, à Piana, à mi-chemin entre Ajaccio et Calvi, sur la route du bord de mer corse.","Calanques de Piana (Corsican: E Calanche di Piana) are Corsican calanques located in Piana, between Ajaccio and Calvi, in the gulf of Porto. It is part of a UNESCO World Heritage Site named ""Gulf of Porto: Calanche of Piana, Gulf of Girolata, Scandola Reserve"".",332451,5045664,1,Wikipédia : Calanques de Piana,Wikipédia : Calanques de Piana
Sainte-Énimie,Sainte-Enimie,city,acategoriser2,"[44.366298,3.41047500000002]",www.sainte-enimie.fr,48210 Sainte-Énimie,"Sainte-Enimie est une ancienne commune française située dans le département de la Lozère, en région Occitanie. Elle a été intégrée en 2017 à la commune nouvelle de Gorges du Tarn Causses.
Située dans les gorges du Tarn, le village de Sainte-Enimie est adhérent à l'association des plus beaux villages de France.","Sainte-Enimie is a former commune in the Lozère department in southern France. On 1 January 2017, it was merged into the new commune Gorges du Tarn Causses. It was founded in the 7th century by Énimie, who started a convent there after being cured of leprosy in the surrounding waters. It was the site of several monasteries, some of which still remain. Located in the Gorges du Tarn, it is a member of Les Plus Beaux Villages de France association.",155993,5476950,1,Wikipédia : Sainte-Enimie,Wikipédia : Sainte-Enimie
Évian-les-Bains,Évian-les-Bains,city,rhone,"[46.401488,6.59094900000002]",,74500 Évian-les-Bains,"Évian-les-Bains, simplement appelée Évian, est une commune française de Haute-Savoie en région Auvergne-Rhône-Alpes, chef-lieu du canton d'Évian-les-Bains et ville centre de la communauté de communes Pays d'Évian Vallée d'Abondance, située sur les bords du lac Léman. Évian est surtout connue comme ville thermale et son eau minérale Évian, exploitée par la Société anonyme des eaux minérales d’Évian, filiale du groupe Danone.","Évian-les-Bains (French pronunciation: ​[evjɑ̃ le bɛ̃]), or simply Évian  (Arpitan: Évyan, Èvian, or L'Èvian), is a commune in the northern part of the Haute-Savoie department in the Auvergne-Rhône-Alpes region in south-eastern France.
A high-market holiday resort and spa town on the shores of Lake Geneva (French: Lac Léman), it has been visited, over two centuries, by royalty such as Kings Edward VII and George V of the United Kingdom and King Farouk of Egypt, and celebrities such as countess Anna de Noailles and Marcel Proust.",11279,550686,1,Wikipédia : Évian-les-Bains,Wikipédia : Évian-les-Bains
Domme,"Domme, Dordogne",city,acategoriser2,"[44.801305,1.21704799999998]",,24250 Domme,"Domme est une commune française située dans le département de la Dordogne, en région Nouvelle-Aquitaine. Ancienne bastide médiévale, la commune était le chef-lieu du canton de Domme de 1790 à 2015.
Elle fait partie de l'association Les Plus Beaux Villages de France.","Domme (Occitan: Doma) is a commune in the Dordogne department in Nouvelle-Aquitaine in southwestern France. It is sometimes called the ""Akropolis des Périgord"".",377427,13380690,1,Wikipédia : Domme,"Wikipédia : Domme, Dordogne"
Saorge,Saorge,city,acategoriser2,"[43.988452,7.55199500000003]",,06540 Saorge,"Saorge (Sauèrge [saˈuə̥dʒ] en royasque, Savurgë en brigasque, Savurgiu en ligure, Saorj en occitan,  Saorgio en italien) est une commune française située dans le département des Alpes-Maritimes en région Provence-Alpes-Côte d'Azur.
Partie du comté de Nice (royaume de Piémont-Sardaigne) jusqu'en 1860, Saorge est rattachée à la France à la suite du traité de Turin.
Ses habitants sont appelés les Saorgiens. Elle est voisine de Breil-sur-Roya et de Pigna dans la province d'Imperia en Italie. Le vieux village perché a la caractéristique d'avoir deux accès routiers indépendants et non reliés (sauf piétonnier).","Saorge (Italian: Saorgio, Occitan: Saorj, Ligurian: Savurgiu) is a commune in the Alpes-Maritimes department in southeastern France. Highway E74 which runs north from Menton, passes through Saorge on its way to the Col de Tende (Italian: Colle di Tenda) where it crosses into Italy.
The region belonged to the old County of Nice. Beginning in 1388 Saorge was part of Sardinia-Piedmont. In June 1793, Sardinia defeated the armies of the First French Republic in the First Battle of Saorgio. In the Second Battle of Saorgio in April 1794 the French wrested the town from the Piedmontese. The town was returned to Sardinia-Piedmont after the overthrow of Napoleon Bonaparte and finally ceded to France in 1860.",321540,15325132,1,Wikipédia : Saorge,Wikipédia : Saorge
Mont Gerbier de Jonc,Mont Gerbier de Jonc,nature,rhone,"[44.844444,4.22000000000003]",,"Mont Gerbier de Jonc, 07310 Saint-Martial","Le mont Gerbier-de-Jonc, ou simplement le Gerbier de Jonc, est un sommet de France situé en Ardèche, dans le Massif central, sur la commune de Saint-Martial tandis que celle de Sainte-Eulalie s'étend à ses pieds au sud. Dénommé suc dans la région, il est célèbre par sa forme particulière et son extraordinaire richesse naturelle et sauvage ; mais aussi parce qu’il accueille à son pied les trois sources de la Loire, le plus long fleuve de France.
Site classé depuis 1933, il est par ordre d'importance le deuxième site touristique du département de l'Ardèche, après les gorges de l'Ardèche. Chaque année, 500 000 personnes escaladent le Gerbier de Jonc.","Mont Gerbier de Jonc is a mountain of volcanic origin located in the Massif Central in France. It is made of a type of rock called phonolite. It rises to an altitude of 1,551 m (5,089 ft), and its base contains three springs that are the source of the Loire, France's longest river. It is the second most-visited site in the département of Ardèche, after the Ardèche Gorges.Mont Gerbier de Jonc was formed 8 million years ago when a volcano erupted molten phonolite lava. The lava was too viscous to flow far and it cooled to form a lava dome of phonolite rock in the crater of the volcano. The lava dome has columnar jointing, which formed during cooling of the lava. The volcanic cone containing the lava dome was later eroded away, exposing the lava dome.",238283,21645306,1,Wikipédia : Mont Gerbier-de-Jonc,Wikipédia : Mont Gerbier de Jonc
Walibi Rhône-Alpes,Walibi Rhône-Alpes,event,acategoriser,"[45.6203252,5.56912850000003]",www.walibi.fr,"1380 Route de la Corneille, 38630 Les Avenières","Walibi Rhône-Alpes est un parc d'attractions situé en France sur la commune des Avenières, dans le département de l’Isère en région Auvergne-Rhône-Alpes. Le parc de loisirs en exploitation occupe une superficie de 33 hectares. Il s'étend sur 73 hectares au total.","Walibi Rhône-Alpes is a French theme park located in the commune of Les Avenières, in the Isère department. It is the largest theme park of the Rhône-Alpes region. The park contains more than 33 rides and it covers an area of 35 hectares.
The park had an income of 8,8 million euros in 2005, and it greets over 400,000 visitors yearly.
Walibi Rhône-Alpes also contains a 13,000 m² waterpark called L'Île aux Pirates (previously Aqualibi).
As of 2006, the park is owned and operated by Compagnie des Alpes, which also owns many theme parks and ski resorts across Europe.",7636005,38497418,3,Wikipédia : Walibi Rhône-Alpes,Wikipédia : Walibi Rhône-Alpes
Besse-et-Saint-Anastaise,Besse-et-Saint-Anastaise,city,rhone,"[45.511707,2.93340799999999]",,"13 Rue Notre Dame, 63610 Besse-et-Saint-Anastaise","Besse-et-Saint-Anastaise (en occitan : Bèssa) est une commune française située dans le département du Puy-de-Dôme, en région d'Auvergne-Rhône-Alpes. Elle fait partie du parc naturel régional des volcans d'Auvergne. Ses habitants sont appelés les Bessards.","Besse-et-Saint-Anastaise, also known as Besse-en-Chandesse (its official name from April 2, 1961 to July 1, 1973), or Besse (its name before 1961), is a commune in the Puy-de-Dôme department in Auvergne-Rhône-Alpes in central France.
The nearby ski resort of Super-Besse is to host the first mountain finish of the 2008 Tour de France.",83329,15930774,1,Wikipédia : Besse-et-Saint-Anastaise,Wikipédia : Besse-et-Saint-Anastaise
Provins,Provins,city,acategoriser2,"[48.560149,3.29920300000003]",,77160 Provins,"Provins (prononcé [pʁɔ.ˈvɛ̃]) est une commune française située à soixante-dix-sept kilomètres au sud-est de Paris, sous-préfecture du département de Seine-et-Marne dans la région Île-de-France. Elle est le chef-lieu de l'arrondissement et du canton. Ses habitants sont appelés les Provinois.
Ancienne capitale des comtes de Champagne, Provins est inscrite depuis le 13 décembre 2001 sur la liste du patrimoine mondial de l'UNESCO .","Provins (French pronunciation: ​[pʁo.vɛ̃]) is a commune in the Seine-et-Marne department in the Île-de-France region in north-central France.
Provins, a town of medieval fairs, became a UNESCO
World Heritage Site in 2001.",19490,799464,1,Wikipédia : Provins,Wikipédia : Provins
Balazuc,Balazuc,city,rhone,"[44.509106,4.37270699999999]",,07120 Balazuc,"Balazuc est une commune française, située dans le département de l’Ardèche en région Auvergne-Rhône-Alpes, labellisée Village de caractère et adhérant à l'association Les Plus Beaux Villages de France.","Balazuc is a French commune in the Ardèche department in the Auvergne-Rhône-Alpes region of southern France.
The village has been labelled a ""Village of Character"" by the Departmental Committee of Tourism. It is a member of Les Plus Beaux Villages de France (The most beautiful villages in France) Association.
The inhabitants of the commune are known as Balazucains or Balazucaines.",322592,12942105,1,Wikipédia : Balazuc,Wikipédia : Balazuc
Église Saint-Michel de Murato,San Michele de Murato,city,corse,"[42.5860801,9.33353179999995]",,"1130 A Qua U Péru, 20239 Murato","L'église Saint-Michel (San Michele) est une église catholique située à Murato, en France.","San Michele de Murato is a church in Murato, Haute-Corse, Corsica. The building was classified as a Historic Monument in 1840.",5461611,33550644,1,Wikipédia : Église Saint-Michel de Murato,Wikipédia : San Michele de Murato
Belcastel,"Belcastel, Aveyron",city,acategoriser2,"[44.387444,2.33455600000002]",,12390 Belcastel,"Belcastel (en occitan Bèl Castèl, littéralement « Beau Château ») est une commune française, située dans le département de l'Aveyron en région Occitanie. Elle faisait partie autrefois de l'ancienne province du Rouergue. Un des plus beaux villages de France.","Belcastel (Bèl Castèl in Occitan) is a commune in the Aveyron department in southern France.
The village is medieval in character, with cobbled streets and lauze-roofed (stone tiled) houses. The bulk of the village and the castle (Château de Belcastel) are situated on the steep north bank of the Aveyron river. Several buildings including the 15th-century church are on the south side of the river, with a similarly aged bridge (pictured) connecting the two. A ruined fort can also be found about a kilometre west of the village on the south bank of the river. It was nominated as one of the ""most beautiful villages of France"" (Les Plus Beaux Villages de France), and the local council regularly hosts watercolour competitions and art exhibitions during the summer.",334636,5651319,1,Wikipédia : Belcastel (Aveyron),"Wikipédia : Belcastel, Aveyron"
Musée Fesch,Musée Fesch,museum,corse,"[41.9220381,8.73846130000004]",www.musee-fesch.com,"50-52 Rue Cardinal Fesch, 20000 Ajaccio","Le Palais Fesch-Musée des Beaux-Arts est un musée d'art de la ville d'Ajaccio en Corse. Situé dans le quartier du Borgu d'Ajaccio, dans le palais et la rue du même nom, le Musée Fesch a été créé par le don fait à sa ville natale par le cardinal Joseph Fesch, oncle de Napoléon Ier. 
Il présente notamment une des plus remarquables collections de peinture ancienne de France ainsi que l'une des plus importantes collections napoléoniennes. Il bénéficie du label « musée de France ».","The musée Fesch (officially, Palais Fesch-musée des beaux-arts) is the central museum of fine arts in Ajaccio on Corsica. Located within the gated Palais Fesch, it is in the town's Borgu d'Ajaccio quarter. It was established by Napoleon I's uncle, cardinal Joseph Fesch (a Prince of France from 1807), in Fesch's birthplace.",3447637,32612008,1,Wikipédia : Musée Fesch,Wikipédia : Musée Fesch
Jardin des Tuileries,Tuileries Garden,nature,acategoriser2,"[48.8634916,2.32749430000001]",,"Place de la Concorde, 75001 Paris","Le jardin des Tuileries, parfois appelé jardins des Tuileries au pluriel, est un parc parisien du 1er arrondissement créé au XVIe siècle, à l'emplacement d'anciennes tuileries qui lui ont donné son nom.","The Tuileries Garden (French: Jardin des Tuileries, IPA: [ʒaʁdɛ̃ de tɥilʁi]) is a public garden located between the Louvre and the Place de la Concorde in the 1st arrondissement of Paris, France. Created by Catherine de' Medici as the garden of the Tuileries Palace in 1564, it was eventually opened to the public in 1667 and became a public park after the French Revolution. In the 19th, 20th and 21st centuries, it was a place where Parisians celebrated, met, strolled and relaxed.",43293,299713,1,Wikipédia : Jardin des Tuileries,Wikipédia : Tuileries Garden
La Mer de Sable,La Mer de Sable,event,acategoriser,"[49.145131,2.67452800000001]",www.merdesable.fr,"N330, 60950 Ermenonville","La Mer de Sable est un parc à thème ouvert en 1963 et situé au cœur de la forêt d'Ermenonville, à proximité immédiate d'Ermenonville dans l'Oise. Il est le plus vieux parc à thème en activité en France,,,.
Le parc offre à ses visiteurs la découverte de trois univers : « Les portes du désert » avec sa dune, « au temps des pionniers » sur la conquête de l’Ouest et « la jungle » avec son monde exotique.
Plutôt destiné aux enfants de moins de 14 ans, le parc propose vingt-trois attractions dont cinq plaines de jeux et autres ponts de singe, quatre spectacles vivants dont deux équestres, une ferme avec deux-cents animaux et une balade à poney.
Le parc appartient à la société : Les Centres Attractifs Jean Richard filiale de Looping Holding.",La Mer de Sable is an amusement park founded 1963 and is located in Ermenonville Forest. The park is close to the commune of Ermenonville in the Oise department of northern France. The park is owned and operated by the Looping Group.,616098,60754517,1,Wikipédia : La Mer de sable,Wikipédia : La Mer de Sable
Lascaux IV Centre International de l'Art Pariétal,Lascaux,museum,acategoriser2,"[45.058139,1.169669]",www.lascaux.fr,"Avenue de Lascaux, 24290 Montignac","La grotte de Lascaux, située sur la commune de Montignac en Dordogne, dans la vallée de la Vézère, en France, est l'une des plus importantes grottes ornées du Paléolithique par le nombre et la qualité esthétique de ses œuvres. Elle est parfois surnommée « la chapelle Sixtine de l'art pariétal » ou « chapelle Sixtine du Périgordien » selon une expression attribuée à Henri Breuil,, qui la nomme également « Versailles de la Préhistoire » ou « Altamira française ».
Les peintures et les gravures qu'elle renferme n’ont pas pu faire l’objet de datations directes précises : leur âge est estimé entre environ 18 000 et 17 000 ans à partir de datations et d’études réalisées sur les objets découverts dans la grotte. La plupart des préhistoriens les attribuent au Magdalénien ancien, sauf quelques-uns qui penchent plutôt pour le Solutréen qui le précède, voire pour le Gravettien.","Lascaux (French: Grotte de Lascaux, ""Lascaux Cave""; English: , French: [lasko]) is the setting of a complex of caves near the village of Montignac, in the department of Dordogne in southwestern France. Over 600 parietal wall paintings cover the interior walls and ceilings of the cave. The paintings represent primarily large animals, typical local and contemporary fauna that correspond with the fossil record of the Upper Paleolithic time. The drawings are the combined effort of many generations, and with continued debate, the age of the paintings is estimated at around 17,000 years (early Magdalenian). Lascaux was inducted into the UNESCO World Heritage Sites list in 1979, as an element of the Prehistoric Sites and Decorated Caves of the Vézère Valley.",3852960,18594,1,Wikipédia : Grotte de Lascaux,Wikipédia : Lascaux
Walygator Parc,Walygator Parc,event,acategoriser,"[49.2253495,6.15599759999998]",walygatorparc.com,"Voie Romaine, 57280 Maizières-lès-Metz","Walygator Parc, anciennement Big Bang Schtroumpf, Walibi Schtroumpf puis Walibi Lorraine, est un parc d'attractions situé sur la commune française de Maizières-lès-Metz dans le département de la Moselle.","Walygator Parc is an amusement park located in Maizières-les-Metz, Lorraine, France. Since its opening, back in 1989, the park has taken on a variety of names; successively Big Bang Smurf, Walibi Schtroumpf (Smurf), Walibi Lorraine up to its present name Walygator Parc.",1672085,26373305,1,Wikipédia : Walygator Parc,Wikipédia : Walygator Parc
Seguret,Séguret,city,acategoriser2,"[44.20559,5.02309100000002]",,84110 Seguret,"Séguret est une commune française, située dans le département de Vaucluse en région Provence-Alpes-Côte d'Azur.",Séguret is a commune in the Vaucluse department in the Provence-Alpes-Côte d'Azur region in southeastern France.,3905471,12034835,1,Wikipédia : Séguret,Wikipédia : Séguret
