title,title-en,category,region,position,website,address,desc-fr,desc-en,wiki-fr,wiki-en,popularity,credit-desc-fr,credit-desc-en
Parc national de la Vanoise,Vanoise National Park,nature,rhone,"[45.3902213,6.86292819999994]",www.vanoise-parcnational.fr,,"Le parc national de la Vanoise est un parc national situé en France dans le département de la Savoie en région Auvergne-Rhône-Alpes.
Le parc national s'étend sur le massif de la Vanoise entre la vallée de l’Isère, la Tarentaise au nord et celle de l’Arc, la Maurienne au sud. Suite au décret ministériel du 27 avril 2015 approuvant sa charte, et à la décision des communes d'adhérer ou non,  il est composé d'une zone protégée, dite « zone cœur », de 535 km2, et d'une aire d'adhésion, sans protection spécifique, comprenant le territoire des communes de Peisey-Nancroix et de Saint-Martin-de-Belleville. Pendant le travail de mise en place de la charte, conformément à la loi du 14 avril 2006, l'aire optimale d'adhésion (AOA) s'étendait sur le territoire de vingt-neuf communes (ex-zone périphérique initialement composée de 28 communes, plus Bozel)  ; elles ont eu librement la possibilité d'adhérer à la charte constituant un projet de protection, et de développement du territoire respectueux de l'environnement.
Accolé à la frontière franco-italienne, le parc jouxte par ailleurs le parc national italien du Grand-Paradis sur quatorze kilomètres le long de la frontière, avec lequel il est jumelé depuis 1972. La zone de cœur du parc français et le parc italien forment ainsi, avec leurs 1 250 km2, la surface protégée la plus étendue en Europe occidentale.","Vanoise National Park (French: Parc national de la Vanoise), is a French national park between the Tarentaise and Maurienne valleys in the French Alps, containing the Vanoise massif. It was created in 1963, and is the first French national park. 
The Vanoise National Park is in the département of Savoie. Small villages like Champagny-le-Haut, Termignon, La Chiserette, Bramans, Sollières-Sardières, Friburge, Pralognan-la-Vanoise and Séez, lie near the park. The park is bordered by several large French ski resorts (Les Trois Vallées, Tignes, Val-d'Isère, Les Arcs, La Plagne).
On the Italian side of the border, the park is continued by the Gran Paradiso National Park. Together, these two parks cover over 1250 km², making the area the largest alpine national park.",69436,5131658,1,Wikipédia : Parc national de la Vanoise,Wikipédia : Vanoise National Park
Château d'Ussé,Château d'Ussé,historical,acategoriser,"[47.2500053,0.291321899999957]",www.chateaudusse.fr,37420 Rigny-Ussé,"Le château d'Ussé se trouve à Rigny-Ussé, en Indre-et-Loire (région Centre, France). Il fait partie des châteaux de la Loire.
Domaine privé ouvert à la visite, il appartient au 7e Duc de Blacas.
Il fait l’objet  de multiples protections au titre des monuments historiques : un classement depuis le 15 avril 1931 pour la chapelle, un classement le 18 janvier 1951 pour les façades et les toitures du château, les fossés, les terrasses, les façades et les toitures des pavillons d'entrée et des communs, l'orangerie et le parc et une inscription le 2 mars 1927 pour toutes les autres parties du château non classées.","Ussé is a castle in the Indre-et-Loire département, in France. The stronghold at the edge of the Chinon forest overlooking the Indre Valley was first fortified in the eleventh century by the Norman seigneur of Ussé, Gueldin de Saumur, who surrounded the fort with a palisade on a high terrace.  The site passed to the Comte de Blois, who rebuilt in stone.
In the fifteenth century, the ruined castle of Ussé was purchased by Jean V de Bueil, a captain-general of Charles VII who became seigneur of Ussé in 1431 and began rebuilding it in the 1440s; his son Antoine de Bueil married in 1462 Jeanne de Valois, the biological daughter of Charles VII and Agnès Sorel, who brought as dowry 40000 golden écus. Antoine was heavily in debt and in 1455, sold the château to Jacques d’Espinay, son of a chamberlain to the Duke of Brittany and himself chamberlain to the king; Espinay built the chapel, completed by his son Charles in 1612, in which the Flamboyant Gothic style is mixed with new Renaissance motifs, and began the process of rebuilding the fifteenth-century château that resulted in the sixteenth-seventeenth century aspect of the structure to be seen today. 

In the seventeenth century Louis I de Valentinay, comptroller of the royal household, demolished the north range of buildings in order to open the interior court to the spectacular view over the parterre terrace, to a design ascribed to André Le Nôtre. Valentinay's son-in-law was the military engineer Vauban, who visited Ussé on numerous occasions. The tradition maintained at Ussé is that this was the castle Charles Perrault had in mind when writing ""The Sleeping Beauty"" . Later Ussé passed to the Rohan. In 1802 Ussé was purchased by the duc de Duras; as early as March 1813, low-key meetings were held at Ussé among a group of Bourbon loyalists, who met to sound out the possibilities of a Bourbon Restoration: such men as Trémouille,  duc de Fitzjames, the prince de Polignac, Ferrand, Montmorency and the duc de  Rochefoucault attended. Here later François-René de Chateaubriand worked on his Mémoires d'Outre-Tombe as the guest of duchesse Claire de Duras.
In 1885 the comtesse de la Rochejaquelein bequeathed Ussé to her great-nephew, the comte de Blacas. Today the château belongs to his descendant Casimir de Blacas d' Aulps the 7th Duke of Blacas.Famed for its picturesque aspect, Ussé was the subject of a French railroad poster issued by the Chemin de Fer de Paris à Orléans in the 1920s and was one of several that inspired Walt Disney in the creation of many of the Disney Castles.
Ussé was classified as a monument historique in 1931 by the French Ministry of Culture.",149703,89027,1,Wikipédia : Château d'Ussé,Wikipédia : Château d'Ussé
Estaing,"Estaing, Aveyron",city,acategoriser2,"[44.554877,2.67203500000005]",,12190 Estaing,"Estaing est une commune française située dans le département de l'Aveyron, en région Occitanie.
Elle est adhérente de l'association Les Plus Beaux Villages de France.","Estaing (Occitan: Estanh) is a commune in the Aveyron department in the Occitanie region of Southern France. In 2016, it had a population of 491. The D'Estaing family, first mentioned in writings in 1028, was one of the most powerful families of the Rouergue from the 13th to the 18th century, making the village known throughout France.",334706,5650157,1,Wikipédia : Estaing (Aveyron),"Wikipédia : Estaing, Aveyron"
Lac de Nino,Lac de Nino,nature,corse,"[42.2554719,8.94040389999998]",,,"Le lac de Nino, source du Tavignano (deuxième fleuve de Corse, tant par sa longueur que par son débit), est situé sur le plateau du Camputile. Il est entouré de pozzines, sortes de petits lacs tourbeux.","Lac de Nino is a lake in Haute-Corse, France. At an elevation of 1743 m, its surface area is 0.065 km².",349055,21597240,1,Wikipédia : Lac de Nino,Wikipédia : Lac de Nino
Saint-Montan,Saint-Montan,city,acategoriser2,"[44.440076,4.62359500000002]",,07220 Saint-Montan,"Saint-Montan est une commune française, située dans le département de l'Ardèche en région Auvergne-Rhône-Alpes.
Ses habitants sont appelés les Saint-Montanais.",Saint-Montan is a commune in the Ardèche department in southern France.,323439,13835764,1,Wikipédia : Saint-Montan,Wikipédia : Saint-Montan
Europa-Park Mitarbeiterparkplatz,Europa-Park,event,acategoriser,"[48.2637946,7.71592580000004]",www.europapark.de,"Europa-Park-Straße 2, 77977 Rust, Allemagne","Europa-Park est un parc à thèmes et complexe de loisirs allemand situé à Rust (Bade-Wurtemberg), entre les villes de Fribourg-en-Brisgau en Allemagne et Strasbourg en France. Fondé par la famille Mack (détentrice de l'entreprise Mack Rides), il est inauguré le 12 juillet 1975.
Le parc comporte 59 attractions et dispose d'un complexe hôtelier avec un total de 5 800 lits ; il s'agit du plus grand parc à thèmes et complexe hôtelier d'Allemagne,.
Avec 5,72 millions d'entrées en 2018, Europa-Park se place en 2e position des parcs d'attractions les plus visités en Europe, derrière le Parc Disneyland. Il est élu de 2014 à 2019 meilleur parc de loisirs du monde par le magazine américain de référence Amusement Today. Il est l'un des parcs à thème d'Europe à avoir été distingué par un Thea Classic Awards, décerné par la Themed Entertainment Association.","Europa-Park is the largest theme park in Germany, and the second most popular theme park resort in Europe, following Disneyland Paris. Europa-Park is located in Rust, in south-western Germany, between Freiburg im Breisgau and Strasbourg (in neighboring France).
The park is home to 13 roller coasters, the oldest being Alpenexpress Enzian, a powered coaster that speeds through a diamond mine, and the newest coaster being the Ba-a-a Express, a small kiddie roller coaster. Europa-Park has very high capacity roller coasters and attractions meaning the park can accommodate approximately 60,000 guests per day. It counted 5.7 million visitors in 2017. It is also the location of the Euro Dance Festival.
Since 2014, Europa-Park has been named the world's best amusement park by the Golden Ticket Awards. In November 2019, Europa-Park's Rulantica water park opened, along with a new themed hotel ""Krønasår"".",231172,2732300,3,Wikipédia : Europa-Park,Wikipédia : Europa-Park
Monte Cinto,Monte Cinto,nature,corse,"[42.379456,8.94589199999996]",,20224 Lozzi,"Le Monte Cinto est le plus haut sommet de Corse et culmine à 2 706 m. Il est le point culminant du massif du même nom, dans le nord-ouest de l'île.","Monte Cinto (Corsican: Monte Cintu) is the highest mountain on the island of Corsica, a région of France.",367408,3185938,1,Wikipédia : Monte Cinto,Wikipédia : Monte Cinto
Cathédrale Notre-Dame de Paris,Notre-Dame de Paris,historical,acategoriser,"[48.8529682,2.34990210000001]",www.notredamedeparis.fr,"6 Parvis Notre-Dame - Pl. Jean-Paul II, 75004 Paris","La cathédrale Notre-Dame de Paris, communément appelée Notre-Dame, est la cathédrale de l'archidiocèse de Paris, située sur l'île de la Cité. Dédiée à la Vierge Marie, elle est pendant de nombreux siècles l'une des cathédrales les plus grandes d'Occident. Longtemps la plus haute construction de la ville, elle est l'un des monuments les plus emblématiques de Paris.
Commencée sous l'impulsion de l'évêque Maurice de Sully, sa construction s'étend sur plus de deux siècles, de 1163 au milieu du XIVe siècle. Après la Révolution française, la cathédrale bénéficie entre 1844 et 1864 d'une importante restauration, parfois controversée, sous la direction de l’architecte Viollet-le-Duc, qui y incorpore des éléments et des motifs inédits. Pour ces raisons, le style n’est pas d'une uniformité totale : la cathédrale possède des caractères du gothique primitif et du gothique rayonnant. Les deux rosaces, qui ornent chacun des bras du transept, sont parmi les plus grandes d’Europe.
Édifice à la fois religieux et patrimonial, elle est liée à de nombreux épisodes de l’histoire de France. Église paroissiale royale au Moyen Âge, elle accueille l’arrivée de la Sainte Couronne en 1239, puis le sacre de Napoléon Ier en 1804, le baptême du duc de Bordeaux en 1821, ainsi que les funérailles de plusieurs présidents de la République française (Adolphe Thiers, Sadi Carnot, Paul Doumer, Charles de Gaulle, Georges Pompidou, François Mitterrand). C'est aussi sous ses voûtes qu'est chanté un Magnificat lors de la libération de Paris, en 1944. Le 850e anniversaire de sa construction est célébré en 2013.
La cathédrale inspire de nombreuses œuvres artistiques, notamment le roman de Victor Hugo Notre-Dame de Paris paru en 1831 et qui influence en partie son histoire. Au début du XXIe siècle, Notre-Dame est visitée chaque année par quelque 13 à 14 millions de personnes. L’édifice, aussi basilique mineure, est ainsi le monument le plus visité en Europe et l'un des plus visités au monde jusqu'en 2019.
Le 15 avril 2019, un violent incendie détruit la flèche et la totalité de la toiture couvrant la nef, le chœur et le transept. Il s'agit du plus important sinistre subi par la cathédrale depuis sa construction. Notre-Dame est, depuis cette date, fermée au public pour une durée indéterminée.

","Notre-Dame de Paris (; French: [nɔtʁə dam də paʁi] (listen); meaning ""Our Lady of Paris""), referred to simply as Notre-Dame, is a medieval Catholic cathedral on the Île de la Cité in the 4th arrondissement of Paris. The cathedral was consecrated to the Virgin Mary and considered to be one of the finest examples of French Gothic architecture. Its pioneering use of the rib vault and flying buttress, its enormous and colourful rose windows, as well as the naturalism and abundance of its sculptural decoration set it apart from the earlier Romanesque style. Major components that make Notre Dame stand out include one of the world's largest organs and its immense church bells.The cathedral's construction began in 1160 under Bishop Maurice de Sully and was largely complete by 1260, though it was modified frequently in the following centuries. In the 1790s, Notre-Dame suffered desecration during the French Revolution; much of its religious imagery was damaged or destroyed. In the 19th century, the cathedral was the site of the coronation of Napoleon I and funerals of many Presidents of the Republic.
Popular interest in the cathedral blossomed soon after the publication, in 1831, of Victor Hugo's novel Notre-Dame de Paris (better known in English as The Hunchback of Notre-Dame). This led to a major restoration project between 1844 and 1864, supervised by Eugène Viollet-le-Duc. The liberation of Paris was celebrated within Notre-Dame in 1944 with the singing of the Magnificat. Beginning in 1963, the cathedral's façade was cleaned of centuries of soot and grime. Another cleaning and restoration project was carried out between 1991 and 2000.The cathedral is one of the most widely recognized symbols of the city of Paris and the French nation. As the cathedral of the Archdiocese of Paris, Notre-Dame contains the cathedra of the Archbishop of Paris (Michel Aupetit). In 1805, Notre-Dame was given the honorary status of a minor basilica. Approximately 12 million people visit Notre-Dame annually, making it the most visited monument in Paris. The cathedral was renowned for its Lent sermons, founded by the Dominican Jean-Baptiste Henri Lacordaire in the 1830s. In recent years, an increasing number have been given by leading public figures and state-employed academics.
The cathedral has been progressively stripped of its original decoration and works of art. Several noteworthy examples of Gothic, Baroque, and 19th-century sculptures and a group of 17th- and early 18th-century altarpieces remain in the cathedral's collection. Some of the most important relics in Christendom, including the Crown of Thorns, a sliver of the true cross and a nail from the true cross, are preserved at Notre-Dame.
While undergoing renovation and restoration, the roof of Notre-Dame caught fire on the evening of 15 April 2019. Burning for around 15 hours, the cathedral sustained serious damage, including the destruction of the flèche (the timber spirelet over the crossing) and most of the lead-covered wooden roof above the stone vaulted ceiling. Contamination of the site and the nearby environment resulted. Following the fire, many proposals were made for modernizing the cathedral's design. However, on 16 July 2019, the French Parliament passed a law requiring that it be rebuilt exactly as it appeared before the fire. Stabilising the structure against possible collapse is expected to continue until the end of 2020, with reconstruction beginning in 2021.  The government of France hopes the reconstruction can be completed by Spring 2024, in time for the opening of the 2024 Summer Olympics in Paris.",19424,62233,3,Wikipédia : Cathédrale Notre-Dame de Paris,Wikipédia : Notre-Dame de Paris
Terra Botanica,Terra Botanica,event,acategoriser,"[47.5010817,-0.57086670000001]",www.terrabotanica.fr,"Route d'Épinard, 49000 Angers","Terra Botanica est un parc à thème situé à Angers, dans le quartier Les Hauts de Saint-Aubin, en Maine-et-Loire. Il est orienté vers l'univers du végétal et de la biodiversité.
Le parc vise à mettre en avant le territoire angevin et le savoir-faire de l'Anjou au travers de la botanique et de l'horticulture, reconnue mondialement à Angers. Il cherche également à informer et à éduquer les jeunes générations au respect du monde végétal et de la biodiversité.
Ouvert en avril 2010, propriété du conseil départemental de Maine-et-Loire, Terra Botanica avait pour objectif de devenir la locomotive touristique du département. Cependant, après cinq saisons, la fréquentation décevante et les difficultés financières ont conduit à un repositionnement du parc dans ses attractions et sa communication.",Terra Botanica is an amusement and botanical park in Angers.,4705040,28697440,1,Wikipédia : Terra Botanica,Wikipédia : Terra Botanica
Dennlys Parc,Dennlys Parc,event,acategoriser,"[50.570955,2.15398909999999]",www.dennlys-parc.com,"11 Rue du Moulin, 62560 Dennebrœucq","Dennlys Parc est un parc d'attractions situé à Dennebrœucq, dans le Pas-de-Calais. Leur mascotte est une tortue du nom de Denno.","Dennlys Parc is a theme park in Dennebrœucq, Pas-de-Calais. The park's mascot is Denno the tortoise.",911105,13971562,1,Wikipédia : Dennlys Parc,Wikipédia : Dennlys Parc
Pigna,"Pigna, Haute-Corse",city,corse,"[42.599403,8.90271600000005]",,20220 Pigna,"Pigna est une commune française située dans la circonscription départementale de la Haute-Corse et le territoire de la collectivité de Corse. Le village appartient à la piève d'Aregno, en Balagne.",Pigna is a commune in the Haute-Corse department of France on the island of Corsica.,453110,4877886,1,Wikipédia : Pigna,"Wikipédia : Pigna, Haute-Corse"
Parc du Petit Prince,Parc du Petit Prince,event,acategoriser,"[47.8615079,7.29769020000003]",www.parcdupetitprince.com,"Le Parc du Petit Prince, Rue de l'Espoir, 68190 Ungersheim","Le Parc du Petit Prince, est un parc à thèmes inspiré de l'œuvre d'Antoine de Saint-Exupéry et est à situé à Ungersheim en Alsace (France).
Doté de deux grands ballons captifs et d'un aerobar, il est le premier parc aérien au monde.","Parc du Petit Prince is a theme park in Ungersheim, France.",7938113,47451658,1,Wikipédia : Parc du Petit Prince,Wikipédia : Parc du Petit Prince
Château du Rivau,Château du Rivau,historical,acategoriser,"[47.1038659,0.323063499999989]",www.chateaudurivau.com,"9 Rue du Château, 37120 Lémeré","Le château du Rivau est une forteresse seigneuriale dont les premières fondations remontent au XIIIe siècle. Situé en Touraine dans la commune de Lémeré dans le département français d'Indre-et-Loire, le Rivau est l'un des châteaux de la Loire et fait l’objet de classements au titre des monuments historiques depuis juillet 1918 (château) et août 1999 (communs) ainsi que d'une inscription en février 1988 (ferme).
Le Rivau combine des élements de l'architecture médiévale, l'architecture de la Renaissance, et l'art contemporain.","The Château du Rivau is a castle-palace in Lémeré (Indre-et-Loire), in the Touraine region, France. In Rabelais' Gargantua, it was given to captain Tolmere as a reward for his victories in the Picrocholean Wars.
In 1429, towards the end of the Hundred Years' War, before the siege of Orleans, Joan of Arc and her followers came to fetch horses at Le Rivau, already renowned for the quality of its equipage and war horses who were raised there. In 1510 François de Beauvau, captain of King Francis I of France, constructed the monumental stables, in the outbuildings' courtyard, that supplied royal stallions. Those stables became the royal stables of Henri III and housed his stallions. An exhibit shows the history of the King's horses and tells the visitor about the mythical horses: Pegasus, Unicorn...
Since 1992, the new owners have undertaken a huge renovation campaign to prevent the decay of the castle, stable and winery. This ensemble is quite exceptional in the region and has been classified as a monument historique since 1918 by the French Ministry of Culture.",1008541,4732323,1,Wikipédia : Château du Rivau,Wikipédia : Château du Rivau
La Basilique de Vézelay,Vézelay Abbey,historical,acategoriser,"[47.4663856,3.74874039999997]",www.basiliquedevezelay.org,89450 Vézelay,"La basilique Sainte-Marie-Madeleine de Vézelay est une ex abbatiale française du XIIe siècle située à Vézelay, dans le département de l'Yonne en Bourgogne-Franche-Comté. Haut lieu de la chrétienté au Moyen Âge, Vézelay est un lieu de pèlerinage important sur le chemin de Saint-Jacques-de-Compostelle.
Construite entre 1120 et 1150, la basilique de Vézelay est une illustration majeure de l'architecture romane et de l'art roman en général. Le tympan intérieur du narthex, présentant un Christ en gloire, est un des chefs-d'œuvre de la sculpture romane. Reconstruit à la fin du XIIe siècle, le chœur présente un style gothique qui accroît la luminosité de la basilique et contribue à renforcer sa symbolique autour du thème de la lumière divine. En passant du narthex à la nef puis au chœur, le visiteur progresse d'un espace obscur à un espace de plus en plus lumineux, illustrant la transformation intérieure du fidèle. Chaque année au solstice d'été, quand le soleil est en culmination par rapport à la terre, la lumière provenant des fenêtres sud projette une ligne de points lumineux au milieu de la nef avec une rigoureuse précision qui traduit l'intention de l'architecte d'inscrire son bâtiment dans une dimension cosmique.
Rénovée par Viollet-le-Duc à partir de 1840, la basilique fait alors l’objet d’un classement et figure sur la première liste des monuments historiques, celle de 1840. En 1979, elle est inscrite sur la liste du patrimoine mondial de l'UNESCO.
Depuis 1993, le service liturgique est assuré par les Fraternités monastiques de Jérusalem. Des offices ont lieu plusieurs fois par jour.","Vézelay Abbey (French: Abbaye Sainte-Marie-Madeleine de Vézelay) is a Benedictine and Cluniac monastery in Vézelay in the east-central French department of Yonne. The Benedictine abbey church, now the Basilica of Sainte-Marie-Madeleine (Saint Mary Magdalene), with its complex program of imagery in sculpted capitals and portals, is one of the outstanding masterpieces of Burgundian Romanesque art and architecture. Sacked by the Huguenots in 1569,  the building suffered neglect in the 17th and the 18th centuries  and some further damage during the period of the French Revolution.The church and hill at Vézelay were added to the UNESCO list of World Heritage Sites in 1979.
Alleged relics of Mary Magdalene can be seen inside the Basilica.",350708,182194,1,Wikipédia : Basilique Sainte-Marie-Madeleine de Vézelay,Wikipédia : Vézelay Abbey
Château Royal d'Amboise,Château d'Amboise,historical,acategoriser,"[47.4133609,0.987019000000032]",www.chateau-amboise.com,"Montée de l'Emir Abd el Kader, 37400 Amboise","Le château d'Amboise surplombe la Loire à Amboise dans le département d'Indre-et-Loire. Il fait partie des châteaux de la Loire.
Avant d'être rattaché à la couronne en 1434, le château appartenait, depuis plus de quatre siècles, à la puissante famille d'Amboise. Pendant la Renaissance, il sert de résidence à plusieurs Rois de France.
Il a été partiellement détruit après la Révolution : du projet de Charles VIII subsistent toutefois le logis royal, la chapelle Saint-Hubert où reposent les restes présumés de Léonard de Vinci, les terrasses et les tours cavalières qui donnent au monument cette silhouette si singulière.
Le château d'Amboise fait l’objet d’un classement au titre des monuments historiques par la liste de 1840.","The Château d'Amboise is a château in Amboise, located in the Indre-et-Loire département of the Loire Valley in France. Confiscated by the monarchy in the 15th century, it became a favoured royal residence and was extensively rebuilt. King Charles VIII died at the château in 1498 after hitting his head on a door lintel. The château fell into decline from the second half of the 16th century and the majority of the interior buildings were later demolished, but some survived and have been restored, along with the outer defensive circuit of towers and walls. It has been recognised as a monument historique by the French Ministry of Culture since 1840. The Château d'Amboise is situated at an elevation of 81 meters.",123761,81968,1,Wikipédia : Château d'Amboise,Wikipédia : Château d'Amboise
