title,title-en,category,region,position,website,address,desc-fr,desc-en,wiki-fr,wiki-en,popularity,credit-desc-fr,credit-desc-en
Colmar,Colmar,city,alsace,"[48.0793589,7.35851200000002]",www.colmar.fr,68000 Colmar,"Colmar est une commune française du département du Haut-Rhin. Préfecture du département, elle fait partie, depuis le 1er janvier 2016, de la région Grand Est.  
Colmar se trouve dans la région historique et culturelle d'Alsace. 
Elle comptait près de 70 000 habitants au dernier recensement en 2016, ce qui en fait la deuxième commune haut-rhinoise et la troisième commune alsacienne en nombre d'habitants après Strasbourg et Mulhouse. Colmar a choisi de se lier à ces dernières au sein du pôle métropolitain d'Alsace qui fédère les grandes agglomérations alsaciennes dans le but de peser au sein de la nouvelle région Grand Est. Ses habitants sont appelés les Colmariens.
Colmar est mentionnée pour la première fois au IXe siècle. Ville libre du Saint-Empire, elle est membre de la Décapole. Elle connaît un développement rapide à la fin du Moyen Âge et au cours de la Renaissance. Dotée d'une ceinture de remparts, elle souffre néanmoins des troubles liés à la Réforme, de la guerre des Paysans puis de la guerre de Trente Ans, à la suite de laquelle elle devient française. Colmar est annexée à l'Empire allemand en 1871 puis rendue à la France à la suite de l'armistice de 1918. Bien que n'étant pas chef-lieu de région, Colmar abrite une cour d'appel. Cette particularité est due à l'élévation de la ville au rang de capitale judiciaire par l'ancien Conseil souverain d'Alsace en 1698.
La ville possède un riche patrimoine architectural, notamment une ancienne collégiale, plusieurs couvents, un théâtre remarquable, des canaux (petite Venise) et des maisons du Moyen Âge. Sa situation, au centre du vignoble alsacien et proche du piémont vosgien, et son climat particulier propice à la culture de la vigne, lui valent le surnom de « capitale des vins d'Alsace ». C'est également une ville de culture, siège du musée Unterlinden abritant le retable d'Issenheim. Colmar est par ailleurs la ville natale du créateur de la statue de la Liberté à New York, Auguste Bartholdi et de Jean-Jacques Waltz, plus connu sous le nom de Hansi.","Colmar (French: Colmar, pronounced [kɔlmaʁ]; Alsatian: Colmer [ˈkolməʁ]; German during 1871–1918 and 1940–1945: Kolmar) is a city and commune in the Haut-Rhin department and Grand Est region of north-eastern France. The third-largest commune in Alsace (after Strasbourg and Mulhouse), it is the seat of the prefecture of the Haut-Rhin department and of the subprefecture of the Colmar-Ribeauvillé arrondissement.
The city is renowned for its well-preserved old town, its numerous architectural landmarks, and its museums, among which is the Unterlinden Museum, which houses the Isenheim Altarpiece.
Colmar is situated on the Alsatian Wine Route and considers itself to be the ""capital of Alsatian wine"" (capitale des vins d'Alsace).",10320,221013,1,Wikipédia : Colmar,Wikipédia : Colmar
Saint-Émilion,Saint-Émilion,city,aquitaine,"[44.894387,-0.155729000000065]",https://www.saint-emilion-tourisme.com/,33330 Saint-Émilion,"Saint-Émilion (en gascon : Sent Milion) est une commune du Sud-Ouest de la France, située dans le département de la Gironde en région Nouvelle-Aquitaine. Ses habitants sont appelés les Saint-Émilionnais. 
Au cœur du pays du Libournais, dans une région de collines viticoles, cette cité médiévale de 1 874 habitants (en 2017) est campée sur une éminence chatte et est située au carrefour du Bordelais, de la Saintonge et du Périgord. 
Site touristique de premier plan — 1 000 000 personnes en moyenne la visitent chaque année — elle possède une importante parure monumentale (ermitage, église monolithe, église collégiale, palais des archevêques, immeubles cossus et restes de fortifications) qui se décline au gré de ruelles tortueuses (appelées « tertres ») et de placettes ombragées, et jouit de la renommée de son patrimoine œnologique (vignoble de Saint-Émilion) et gastronomique (macarons, pâtés, foies gras). 
Plusieurs manifestations s'y déroulent chaque année dont Philosophia, événement tout public autour de la philosophie créé en 2007 par le metteur en scène et scénographe, Eric Le Collen, s'inspirant du festival de philosophie de Modène,. 
La cité médiévale (et sa « juridiction ») est inscrite au patrimoine mondial de l'humanité par l'Unesco depuis 1999. Elle constitue « l’exemple remarquable d'un paysage viticole historique qui a survécu intact » et « illustre de manière exceptionnelle la culture intensive de la vigne à vin dans une région délimitée avec précision » (critères d’inscription retenus par l’Unesco en décembre 1999 dans la catégorie Paysages culturels). La ville a également servi d'inspiration à la firme de jeux vidéo Squaresoft pour les décors de Vagrant Story, sorti en 2000 sur Playstation.","Saint-Émilion (pronounced [sɛ̃t‿e.mil.jɔ̃]; Gascon: Sent Milion) is a commune in the Gironde department in Nouvelle-Aquitaine in Southwestern France. In 2016, it had a population of 1,938.
In the heart of the country of Libournais (the area around Libourne), in a region of wine hills, Saint-Emilion is a medieval city located at the crossroads of Bordeaux, Saintonge and Périgord.",278197,342844,1,Wikipédia : Saint-Émilion,Wikipédia : Saint-Émilion
Ville close de Concarneau,Walled town of Concarneau,city,bretagne,"[47.8716751,-3.91623460000005]",www.concarneau.fr,"5 Rue Vauban, 29900 Concarneau",La Ville close de Concarneau est une cité fortifiée des XVe et XVIe siècles construite sur un îlot. Elle est le cœur historique de la ville de Concarneau qui s'est progressivement développée autour de l'îlot.,The Walled town of Concarneau is a walled town built in the 15th and 16th century in Concarneau.,8487133,51983976,1,Wikipédia : Ville close de Concarneau,Wikipédia : Walled town of Concarneau
Abbaye de Jumièges,Jumièges Abbey,historical,hautenormandie,"[49.4319323,0.819053899999972]",www.abbayedejumieges.fr,"24 Rue Guillaume le Conquérant, 76480 Jumièges","L'abbaye Saint-Pierre de Jumièges est une ancienne abbaye bénédictine fondée par saint Philibert, fils d'un comte franc de Vasconie vers 654 sur un domaine du fisc royal à Jumièges dans le département de la Seine-Maritime. Elle applique la règle de saint Benoît dès la fin du VIIe siècle après l'avoir utilisée probablement avec la règle de saint Colomban.
Elle marque l'apogée du monachisme normand dans la vallée de la Seine, conserve la plus vaste et la plus précoce des grandes abbatiales normandes, est la seule qui soit restée fidèle à la multiplicité des sanctuaires du très ancien monachisme carolingien et une des clefs de l'art roman normand où l'articulation entre l'architecture carolingienne et l'architecture romane est la plus visible.","Jumièges Abbey was a Benedictine monastery, situated in the commune of Jumièges in the Seine-Maritime département, in Normandy, France.",4996844,5081336,1,Wikipédia : Abbaye de Jumièges,Wikipédia : Jumièges Abbey
Fayl-Billot,Fayl-Billot,city,champagne,"[47.7813469,5.60173599999996]",,52500 Fayl-Billot,"Fayl-Billot est une commune française située dans le département de la Haute-Marne en région Grand Est, à proximité de la Franche-Comté. Fayl se prononce [fɛ.i]. 
La commune est réputée pour la vannerie  et l'osiériculture avec notamment l'École nationale d'osiériculture et de vannerie et la Maison de la vannerie.",Fayl-Billot is a commune in the Haute-Marne department in north-eastern France.,442068,15788283,1,Wikipédia : Fayl-Billot,Wikipédia : Fayl-Billot
Château de Villeneuve-Lembron,,historical,auvergne,"[45.478005,3.18590199999994]",www.villeneuve-lembron.monuments-nationaux.fr,"Château de Villeneuve-Lembron, 63340 Villeneuve-Lembron","Le château de Villeneuve-Lembron est un château situé à Villeneuve entre Clermont-Ferrand et Saint-Flour, dans le département du Puy-de-Dôme en France. Géré pour le compte de l'État par le Centre des monuments nationaux, il est réputé pour l'intérêt de ses décors peints.",,3232140,,1,Wikipédia : Château de Villeneuve-Lembron,
Les remparts de Saint-Malo,,historical,bretagne,"[48.6498605,-2.0285374]",,35400 Saint-Malo,"L'histoire de Saint-Malo remonte à la Protohistoire celtique, où cette région correspond à l'ancien centre maritime du peuple gaulois des Coriosolites, installés à la cité d'Aleth (actuel quartier de Saint-Servan).
Sous l'influence des Romains, la ville de Corseul, dans les terres, se développe aux dépens de la cité d'Aleth, qui reste un port important. À la fin du IIIe siècle, les Romains choisissent de fortifier Aleth, tandis qu'à cette époque, le rocher de Canalch (Canalchius insulae), situé dans la plaine marécageuse formée à l'embouchure de la Rance, qui accueillera la future ville de Saint-Malo est encore inhabité.
Lors du retrait de l'armée romaine vers 420, Aleth subit de nombreuses attaques venues du Nord. Vers 507, saint Aaron se retire des « tentations du monde », sur un rocher de  Kalnach et y construit un oratoire. Il est rejoint par saint Maclou, venant de l'actuel Pays de Galles, vers 538. L'îlot surnommé dans un premier temps « rocher d'Aaron », devient le « rocher de Saint-Malo » à la mort de son compagnon, en 541.
Aleth continue de se développer jusqu'à la fin du millénaire où, après plusieurs attaques des Normands, la ville est durablement affaiblie. Au milieu du XIIe siècle, le diocèse d'Aleth est déplacé sur le rocher de Saint-Malo, mais on ne sait si l'arrivée de l'évêque précède ou suit la première urbanisation de Saint-Malo. Cet événement marque néanmoins la fin de la grandeur d'Aleth. Désormais, la position stratégique du port est l'objet de conflits entre la Bretagne et la France. Après avoir fait partie du domaine du roi de France au début du XVe siècle puis avoir été intégrée au Duché de Bretagne, Saint-Malo est en 1493 définitivement annexée au domaine royal.
C'est avec la découverte des Amériques et le développement des échanges avec les Indes que Saint-Malo prend son envol et s'enrichit considérablement. La ville proclamera même pendant quatre ans son indépendance. Les armateurs deviennent plus nombreux et des personnages de cette époque font la renommée de la ville, Jacques Cartier découvre le Canada, les corsaires harcèlent les marines marchandes et militaires, tels Duguay-Trouin, puis un peu plus tard Surcouf. D'autres s'illustrent dans la science, tel Maupertuis, ou dans les lettres et la politique comme Chateaubriand. Les armateurs se font construire des demeures particulières appelées Malouinières. Avec 218 expéditions négrières aux XVIIe et XVIIIe siècles Saint-Malo figure au cinquième rang des ports français ayant pratiqué le commerce triangulaire, après Nantes (1 714) et La Rochelle (449), Le Havre(441) et Bordeaux (419)L'apogée de Saint-Malo se termine à la Révolution française qui ne l'épargne pas. Saint-Malo continue ensuite de développer la pêche, notamment pour Terre-Neuve. À la fin du XIXe et au XXe siècle, Saint-Malo développe le tourisme, notamment grâce à ses plages. Lors de la Seconde Guerre mondiale, Saint-Malo est particulièrement touchée, la ville est dévastée par les bombardements américains en 1944. Presque entièrement reconstruite à l'original après la guerre, Saint-Malo est désormais un important centre touristique estival, port de pêche et de plaisance.",,2233500,,3,Wikipédia : Histoire de Saint-Malo,
Parlement de Bretagne,,historical,bretagne,"[48.1128856,-1.67812129999993]",,"Parlement de Bretagne, 16 Rue Hoche, 35000 Rennes","Le palais du Parlement de Bretagne, souvent appelé simplement le Parlement de Bretagne, est un bâtiment d'architecture classique construit au XVIIe siècle, situé à Rennes, en Ille-et-Vilaine, et qui fut le siège du Parlement de Bretagne de sa construction jusqu’à sa dissolution par la Révolution française en février 1790, en dehors de son « exil » à Vannes de 1675 à 1689.
L’édifice devient la cour d'appel de Rennes en 1804. Ce monument a été entièrement restauré après l’incendie du 5 février 1994, conséquence d’un incident lié aux violentes manifestations de marins-pêcheurs. Dans des locaux adaptés aux exigences du XXIe siècle, la cour d'appel de Rennes a pu reprendre l’activité qu’elle y déployait depuis près de deux siècles. L'ensemble des autres juridictions a rejoint la cité judiciaire à l'architecture très contemporaine, inaugurée en 1983 dans le quartier de la Tour-d'Auvergne, ou d'autres bâtiments encore.",,3380435,,1,Wikipédia : Palais du Parlement de Bretagne,
Charroux,"Charroux, Allier",city,auvergne,"[46.185442,3.162598]",,03140 Charroux,"Charroux (Charos en occitan) est une commune française, située dans le département de l'Allier en région d'Auvergne-Rhône-Alpes.",Charroux is a commune in the Allier department in central France.,318495,15348273,1,Wikipédia : Charroux (Allier),"Wikipédia : Charroux, Allier"
La Vallée des Saints,,nature,bretagne,"[48.3715514,-3.54217170000004]",www.lavalleedessaints.com,"Quenequillec, 22160 Carnoët","La Vallée des Saints (Traoñienn ar Sent en breton) est un projet associatif de statuaire monumentale en cours de réalisation en Bretagne, sur la colline de Quenequillec à 230 m d'altitude, dans la commune de Carnoët (Côtes-d'Armor).",,3999707,,1,Wikipédia : Vallée des Saints,
Cité de la Dentelle et de la Mode,Cité de la Dentelle et de la Mode,museum,nord,"[50.9504833,1.8594071]",www.cite-dentelle.fr,"135 Quai du Commerce, 62100 Calais","La cité internationale de la dentelle et de la mode est un musée de Calais qui a été inauguré le 11 juin 2009. Il est principalement consacré à l'histoire de la dentelle tissée sur métiers mécaniques. 
La cité internationale de la dentelle et de la mode est installée dans une ancienne usine dentellière, l'usine Boulart, fondée dans les années 1870 et en activité jusqu'en 2000. Le site a été racheté dès 1988 par la ville de Calais avec le projet d'un faire un lieu de valorisation du savoir-faire de la dentelle.",The Cité de la Dentelle et de la Mode is a museum of lace in Pas de Calais in northern France. It is one of two museums in France to celebrate machine lace making. The museum is an Anchor point on the European Route of Industrial Heritage.,3848638,45088511,1,Wikipédia : Cité internationale de la dentelle et de la mode de Calais,Wikipédia : Cité de la Dentelle et de la Mode
Cimetière militaire d'Étaples,Étaples Military Cemetery,historical,nord,"[50.534988,1.62468899999999]",,"D940, 62630 Étaples","Le cimetière militaire britannique d'Étaples est un cimetière situé à Étaples dans le département français du Pas-de-Calais. Géré par la Commonwealth War Graves Commission (CWGC), ce cimetière contient la sépulture de 11 500 combattants des première et deuxième guerres mondiales. Plus grand cimetière britannique de France, il accueille chaque année plus de 25 000 visiteurs.","Étaples Military Cemetery is a Commonwealth War Graves Commission cemetery in Étaples, near Boulogne on the north-west coast of France.  The cemetery holds over 11,500 dead from both World War I and World War II.",6575205,14402868,1,Wikipédia : Cimetière militaire d'Étaples,Wikipédia : Étaples Military Cemetery
Villedieu-les-Poêles,Villedieu-les-Poêles,city,bassenormandie,"[48.838032,-1.22171400000002]",,50800 Villedieu-les-Poêles,"Villedieu-les-Poêles  (prononcé [vildjølepwɑl]), Villedieu jusqu'en 1962, est une ancienne commune française, située dans le département de la Manche en région Normandie, devenue le 1er janvier 2016 une commune déléguée au sein de la commune nouvelle de Villedieu-les-Poêles-Rouffigny.
Elle est peuplée de 3 562 habitants. Comme le rappelle la deuxième partie de son nom, adjointe en 1962, la ville est connue pour son activité de dinanderie et de poêlerie. Elle abrite également une des cinq fonderies de cloches de France, ayant notamment fourni les cloches de Notre-Dame de Paris en 2013. Ces activités ont inspiré l'un des deux noms des habitants de la commune, les Sourdins, que le martelage répétitif du cuivre aurait pu rendre sourds.","Villedieu-les-Poêles is a former commune in the Manche department in Normandy in north-western France. On 1 January 2016, it was merged into the new commune of Villedieu-les-Poêles-Rouffigny.Its inhabitants are called Sourdins from the French sourd meaning deaf. Most of the people involved in the manufacturing of copper pans, which involved repeated hammering, became deaf.",428247,1906732,1,Wikipédia : Villedieu-les-Poêles,Wikipédia : Villedieu-les-Poêles
Goury,Auderville,city,bassenormandie,"[49.7158609,-1.94533000000001]",,"Goury, 50440 Auderville","Auderville (prononcé /odɛʁvil/) est une ancienne commune française, située dans le département de la Manche en région Normandie, peuplée de 245 habitants.
Depuis le 1er janvier 2017, elle fait partie de la nouvelle commune de La Hague et a le statut de commune déléguée.
Auderville est la commune du cap de la Hague. Très touristique, elle est connue pour le port de Goury, qui abrite la station de la SNSM et son canot qui sort par tous les temps Mona Rigolet, et pour le phare de la Hague qui se dresse sur le rocher « le Gros du Raz » à 800 m de la côte. Il balise le courant du Raz Blanchard et le passage de la Déroute entre le cap de la Hague et l'île d'Aurigny. Un canon pointé vers le sud permettait autrefois au sémaphore d'alerter l'équipage du canot de sauvetage.
Le territoire communal témoigne, par de nombreux restes de fortifications, de l'importante présence des militaires allemands pendant la Seconde Guerre mondiale.","Auderville (French pronunciation: ​[odɛʁvil]) is a former commune on the north coast of the Manche department in the Normandy region in northwestern France. On 1 January 2017, it was merged into the new commune La Hague.

",17408,14036453,1,Wikipédia : Auderville,Wikipédia : Auderville
Basilique Sainte-Thérèse de Lisieux,"Basilica of Sainte-Thérèse, Lisieux",historical,bassenormandie,"[49.1396932,0.236395899999934]",www.therese-de-lisieux.catholique.fr,"1 Avenue Jean XXIII, 14100 Lisieux","La basilique Sainte-Thérèse est située à Lisieux, en Normandie. Elle a été élevée en l'honneur de Sainte Thérèse de l'Enfant-Jésus peu de temps après sa canonisation. 
Imposant édifice de style néo-byzantin inspiré de la basilique du Sacré-Cœur de Montmartre, sa construction, sur une hauteur en limite de la ville, a débuté en 1929 et sa consécration a eu lieu en 1954. Aujourd'hui, l'édifice accueille plus de 600 000 visiteurs par an.
Labellisée « Patrimoine du XXe siècle », elle a été inscrite au titre des monuments historiques le 14 septembre 2010 puis classée le 7 septembre 2011.","The Basilica of Sainte-Thérèse of Lisieux (French: Basilique Sainte-Thérèse de Lisieux) is a Roman Catholic church and minor basilica dedicated to Saint Thérèse of Lisieux. Located in Lisieux, France, the large basilica can accommodate 4,000 people, and, with more than two million visitors a year, is the second largest pilgrimage site in France, after Lourdes. Pope John Paul II visited the Basilica on 2 June 1980.",118979,21917922,3,Wikipédia : Basilique Sainte-Thérèse de Lisieux,"Wikipédia : Basilica of Sainte-Thérèse, Lisieux"
Pointe du Hoc,Pointe du Hoc,historical,bassenormandie,"[49.3971886,-0.989270300000044]",,14450 Cricqueville-en-Bessin,"La pointe du Hoc (API : /pwε̃t dy ɔk/) est le nom donné à une petite avancée, un petit cap, de la côte normande dans la mer de la Manche, située dans le Calvados. Elle se compose d'une falaise de 25 à 30 mètres de haut précédée d'une aiguille qui s'avance dans la mer et elle surplombe une plage de galets d'une dizaine de mètres de large à ses pieds. La pointe se trouve sur la commune de Cricqueville-en-Bessin.
Elle fut le théâtre d'une des opérations du débarquement allié en Normandie le 6 juin 1944. Située entre les plages d'Utah Beach (à l’ouest) et d' Omaha Beach (à l'est), la pointe avait été fortifiée par les Allemands (WN 75) et, selon les reconnaissances aériennes alliées, était équipée de pièces d'artillerie lourde dont la portée menaçait les deux plages voisines. Il avait été jugé primordial, pour la réussite du débarquement, que les pièces d'artillerie soient mises hors service le plus rapidement possible.
Cette mission fut confiée au 2e bataillon de Rangers américain qui réussit à prendre le contrôle du site au prix de lourdes pertes. Par la suite, les pièces d'artillerie se révéleront avoir été déplacées par les Allemands peu de temps auparavant et installées 1,3 km en arrière, à l'intérieur des terres.","La Pointe du Hoc (French pronunciation: ​[pwɛ̃t dy ɔk]) is a promontory with a 100-foot (30 m) cliff overlooking the English Channel on the northwestern coast of Normandy in the Calvados department, France. 
During World War II it was the highest point between the American sector landings at Utah Beach to the west and Omaha Beach to the east. The German army fortified the area with concrete casemates and gun pits. On D-Day, the United States Army Ranger Assault Group attacked and captured Pointe du Hoc after scaling the cliffs.",112255,701322,3,Wikipédia : Pointe du Hoc,Wikipédia : Pointe du Hoc
Musée Balzac,,museum,centre,"[47.2458073,0.544668099999967]",www.musee-balzac.fr,"Rue du Château, 37190 Saché",,,,,1,,
Mémorial de Caen,Mémorial de Caen,museum,bassenormandie,"[49.1973431,-0.383979500000009]",www.memorial-caen.fr,"Esplanade Général Eisenhower, 14050 Caen","Le Mémorial de Caen est un musée situé à Caen consacré à l’histoire du XXe siècle dont la thématique tout entière est tournée vers la fragilité de la paix mais c'est avant tout un musée d'histoire.
En 2007, c'était le musée français le plus visité hors Île-de-France avec 400 000 visiteurs.
Le Mémorial de Caen a reçu le label « musée de France » et fait partie de l’International Network of Museums for Peace.
En 2002, le musée s’est agrandi avec l’ouverture d’une nouvelle aile principalement consacrée  à la guerre froide. Les deux parcours muséographiques réunis permettent de couvrir les années 1919 à 1989, du traité de Versailles à la chute du mur de Berlin.
En 2009 et 2010, Le Mémorial de Caen a encore rénové ses parcours et ouvert quatre nouveaux espaces de visite : « Guerre mondiale, Guerre totale » et « Le Débarquement et la Bataille de Normandie » dans la partie consacrée à la Seconde Guerre mondiale, « Berlin au cœur de la guerre froide » dans la partie consacrée à la guerre froide.
Ces parcours ont été rénovés avec la collaboration d'un conseil scientifique créé en 2006. Pierre Laborie et Denis Peschanski en ont été les principaux artisans.
Depuis 2006, Le Mémorial de Caen est en mutation permanente, chaque année ses parcours permanents sont modifiés","The Mémorial de Caen is a museum and war memorial in Caen, Normandy, France commemorating  World War II  and the Battle for Caen. More generally, the museum is dedicated to the history of the twentieth century, mainly focused on the fragility of peace. Its intention is ""pay a tribute to the martyred city of the liberation"" but also to tell ""what was the terrible story of the 20th century in a spirit of reconciliation"".",6404,28204938,3,Wikipédia : Mémorial de Caen,Wikipédia : Mémorial de Caen
Cité médieval de Domfront,"Domfront, Orne",city,bassenormandie,"[48.5941283,-0.651332000000025]",www.ot-domfront.com,"12 Place de la Roirie, 61700 Domfront en Poiraie","Domfront est une ancienne commune française, située dans le département de l'Orne en région Normandie, devenue le 1er janvier 2016 une commune déléguée au sein de la commune nouvelle de Domfront en Poiraie.
Elle est peuplée de 3 486 habitants.","Domfront is a former commune in the Orne department in north-western France. On 1 January 2016, it was merged into the new commune of Domfront-en-Poiraie.",38275,15921373,1,Wikipédia : Domfront (Orne),"Wikipédia : Domfront, Orne"
