title,title-en,category,region,position,website,address,desc-fr,desc-en,wiki-fr,wiki-en,popularity,credit-desc-fr,credit-desc-en
Cathédrale Notre-Dame de Reims,Reims Cathedral,historical,champagne,"[49.2538592,4.03404190000003]",www.cathedrale-reims.com,"Place du Cardinal Luçon, 51100 Reims","La cathédrale Notre-Dame de Reims, est une cathédrale catholique romaine située à Reims, dans le département français de la Marne en région Grand Est. Elle est connue pour avoir été, à partir du XIe siècle, le lieu de la quasi-totalité des sacres des rois de France.
La construction de l'édifice actuel a commencé au début du XIIIe siècle. Elle est postérieure aux cathédrales Notre-Dame de Paris et Notre-Dame de Chartres, mais antérieure aux cathédrales Notre-Dame de Strasbourg, Notre-Dame d'Amiens et Saint-Pierre de Beauvais. Consacrée à la Vierge Marie, la cathédrale de Reims a été achevée au XIVe siècle. Elle a connu une destruction très importante à cause d'un incendie ravageur pendant la Première Guerre mondiale provoqué par un bombardement allemand.
Il s'agit de l'une des réalisations majeures de l'art gothique en France, tant pour son architecture que pour sa statuaire qui compte 2 303 statues. Elle est inscrite, à ce titre, au patrimoine mondial de l'UNESCO depuis 1991. Haut lieu du tourisme champenois, elle a accueilli 1 500 000 visiteurs en 2007.
Elle est le siège de l'archidiocèse de Reims et donc la cathédrale métropolitaine de la province ecclésiastique de Reims.","Notre-Dame de Reims (; French: [nɔtʁə dam də ʁɛ̃s] (listen); meaning ""Our Lady of Reims""), known in English as Reims Cathedral, is a Roman Catholic cathedral in the French city of the same name. The cathedral was dedicated to the Virgin Mary and is famous for being the traditional location for the coronation of the kings of France.
The cathedral church is thought to have been founded by Bishop Saint Nicasius in the early 5th century.  Marking an important conversion, Clovis, King of the Franks, was baptized a Christian here about a century later.  Construction of the present Reims Cathedral began in the 13th century and concluded in the 15th century.  A prominent example of French Gothic architecture, it was built to replace an earlier church destroyed by fire in 1221.  Although little damaged during the French Revolution, the present cathedral saw extensive restoration in the 19th century but was severely damaged during World War I.  The church was again restored in the 20th century.
Reims Cathedral is the seat of the Archdiocese of Reims.
The cathedral, a major tourist destination, receives about one million visitors annually.

",67661,33622280,3,Wikipédia : Cathédrale Notre-Dame de Reims,Wikipédia : Reims Cathedral
Château de Chantilly,,historical,iledefrance,"[49.1938467,2.48520340000005]",www.domainedechantilly.com,60500 Chantilly,"Le domaine de Chantilly est un vaste ensemble de 7 830 hectares de terres composé du château de Chantilly, de ses collections d'œuvres d'art, regroupées dans le musée Condé, de son parc et d’une forêt, la forêt de Chantilly, pour ses éléments les plus célèbres, mais aussi de propriétés, de bâtiments dont plusieurs monuments historiques, de terres agricoles, de terrains de golf. Constitué depuis le Moyen Âge par ses propriétaires successifs, il appartient depuis 1897 à l'Institut de France.
Il s'étend sur 15 communes de l'Oise et du Val-d'Oise. Il est protégé au titre des sites classés depuis 1960.",,323757,,3,Wikipédia : Domaine de Chantilly,
Fort la Latte,Fort-la-Latte,historical,bretagne,"[48.6683283,-2.2848103]",www.lefortlalatte.com,22240 Plévenon,"Le Fort La Latte, aussi appelé château de la Roche Goyon est un château fort situé sur la pointe de la Latte, près du cap Fréhel dans le département des Côtes-d'Armor sur la commune de Plévenon en baie de Saint-Malo . Remarquable par sa situation sur un cap rocheux, face à la mer, il a servi de décor à plusieurs films.
Il fait l’objet d’un classement au titre des monuments historiques depuis les 11 août 1925 et 28 février 1934.","Fort la Latte or Castle of the Rock Goyon is a castle in the northeast of Brittany, about 4 kilometres (2.5 mi) southeast of Cap Fréhel and about 35 kilometres (22 mi) west of Saint-Malo, in the commune of Plévenon, Côtes-d'Armor.
It is a famous tourist attraction of the bay of St Malo and the Emerald coast. This impressive castle was built on a small piece of land at the Bay of the Fresnay in the 13th century. Various films have been shot at this site, including The Vikings (1958) by Richard Fleischer with Kirk Douglas and Tony Curtis. It also features in the French band Manau's video for ""La Tribu de Dana.""  A much larger, fictionalized version of the fort appears in the 2015 animated film April and the Extraordinary World.",41432,3833017,1,Wikipédia : Fort la Latte,Wikipédia : Fort-la-Latte
Sacré-Cœur,,historical,iledefrance,"[48.8867046,2.34310430000005]",www.sacre-coeur-montmartre.com,"35 Rue du Chevalier de la Barre, 75018 Paris",,,,,3,,
"Woinic, Le Colosse des Ardennes",,historical,champagne,"[49.5945785,4.5038376]",,"A34 - Sortie 14, 08270 Saulces-Monclin","Woinic est une sculpture de sanglier géant réalisé par le sculpteur ardennais Éric Sléziak entre le 1er janvier 1983 et le 15 décembre 1993. Il s'agit d'une œuvre monumentale, représentant  un sanglier, l'emblème du département français des Ardennes, et installée sur une aire d'autoroute.",,3174910,,1,Wikipédia : Woinic,
Saint-Jean-Pied-de-Port,Saint-Jean-Pied-de-Port,city,aquitaine,"[43.163141,-1.23811000000001]",,64220 Saint-Jean-Pied-de-Port,"Saint-Jean-Pied-de-Port (en basque Donibane Garazi) est une commune française située dans le département des Pyrénées-Atlantiques, en région Nouvelle-Aquitaine.
Saint-Jean-Pied-de-Port doit son nom à sa situation au pied du port de Roncevaux (alt. 1 057 m), en territoire espagnol. La ville est située au confluent de la Nive et du Laurhibar.
Le gentilé basque est Donibandar (ou Donibanegaraztar). Le gentilé français est Saint-Jeannais. 
Ancienne capitale politique et administrative de la Basse-Navarre d'« Ultrapuertos » (c'est-à-dire d'« Outre-cols »), c'est aujourd'hui un centre d'échanges et d'activités culturelles et sportives basques.
En 2016, la commune a été admise à rejoindre l’association Les Plus Beaux Villages de France.","Saint-Jean-Pied-de-Port (literally ""Saint John [at the] Foot of [the] Pass""; Basque: Donibane Garazi; Spanish: San Juan Pie de Puerto) is a commune in the Pyrénées-Atlantiques department in south-western France close to Ostabat in the Pyrenean foothills. The town is also the old capital of the traditional Basque province of Lower Navarre. Saint-Jean-Pied-de-Port is also a starting point for the French Way Camino Francés, the most popular option for travelling the Camino de Santiago.",190559,1460806,1,Wikipédia : Saint-Jean-Pied-de-Port,Wikipédia : Saint-Jean-Pied-de-Port
Grotte du Pech Merle,Pech Merle,museum,midi,"[44.5073077,1.64408049999997]",www.pechmerle.com,"Pech Merle, 46330 Cabrerets","La grotte du Pech Merle (ou de Pech Merle) est une grotte ornée préhistorique située dans le département du Lot (région Occitanie, France), sur la commune de Cabrerets. Elle s'ouvre dans une colline (pech en occitan) dominant les vallées de la Sagne et du Célé, dans le Quercy. 
Cette grotte, comme d'autres, a été comparée à la chapelle Sixtine ; on attribue cette comparaison à l’abbé Breuil.","Pech Merle is a cave which opens onto a hillside at Cabrerets in the Lot département of the Occitania region in France, about 35 minutes by road east of Cahors. It is one of the few prehistoric cave painting sites in France that remain open to the general public. Extending for over a kilometre and a half from the entrance are caverns, the walls of which are painted with dramatic murals dating from the Gravettian culture (some 25,000 years BC). Some of the paintings and engravings, however, may date from the later Magdalenian era (16,000 years BC).
This area once had a great river flowing through it, cutting underground channels which were later used by humans for shelter and eventually for mural painting.
The cave art located in the deeper areas of the cave was discovered in 1922 by Marthe David, her brother Andre David and Henri Dutetre, three teenagers who had been exploring the cave for two years. Like other children of the area, these three had been encouraged and assisted in their exploration by Father Amedee Lemozi, the curate of Cabrerets and an amateur archaeologist who had discovered other cave paintings in the region.The walls of seven of the chambers at Pech Merle have fresh, lifelike images of woolly mammoth, spotted horses, single colour horses, bovids, reindeer, handprints, and some humans. Footprints of children, preserved in what was once clay, have been found more than half a mile underground. In 2013 the Tracking in Caves-project tested experience based reading of prehistoric footprints by specialised trackers of Ju/'hoansi San with great success. Within a six-mile radius of the site are ten other caves with prehistoric art of the Upper Palaeolithic period, but none of these are open to the public. 
During the Ice Age the caves were very probably used as places of refuge by prehistoric peoples when the area had an Arctic climate, very cold temperatures, and native animal species very different from those of the present day. It is supposed that, at some point in the past, rain and sliding earth covered the cave entrances with an airtight seal until the 20th century.
Experimental reconstruction work by French archaeologist Michel Lorblanchet has suggested that the application of the paint for some of the paintings was probably by means of a delicate spitting technique.

The cave at Pech Merle has been open to the public since 1926. Visiting groups are limited in size and number so as not to destroy the delicate artwork with the excessive humidity, heat and carbon dioxide produced by breathing.",315721,6177364,1,Wikipédia : Grotte du Pech Merle,Wikipédia : Pech Merle
Oradour-sur-Glane,Oradour-sur-Glane,city,limousin,"[45.9310789,1.03274599999997]",,87520 Oradour-sur-Glane,"Oradour-sur-Glane est une commune française située dans le département de la Haute-Vienne, en région Nouvelle-Aquitaine. Ses habitants sont appelés les Radounauds ou Radounaux (forme très peu usitée).
Le nom d'Oradour-sur-Glane reste attaché au massacre de sa population par la division SS Das Reich le 10 juin 1944. La petite cité est aujourd'hui divisée en deux entités, dont le centre de la mémoire constitue en quelque sorte le trait d'union : l'ancien village, conservé à l'état de ruine, qui témoigne des souffrances infligées aux habitants et gens de passage de cette petite bourgade, et le nouveau village, reconstruit quelques centaines de mètres plus loin.","Oradour-sur-Glane (Occitan: Orador de Glana) is a commune in the Haute-Vienne department in the Nouvelle-Aquitaine region in west-central France, as well as the name of the main village within the commune.",70911,44659818,1,Wikipédia : Oradour-sur-Glane,Wikipédia : Oradour-sur-Glane
Musée Portuaire de Dunkerque,,museum,nord,"[51.037759,2.37188000000003]",www.museeportuaire.com,"9 Quai de la Citadelle, 59140 Dunkerque","Le musée portuaire de Dunkerque est un musée maritime et un musée de société, situé dans un lieu édifié en 1868 qui abritait autrefois un entrepôt de tabac, le magasin Bourdon. Il est né en 1992 de l'initiative d'anciens dockers qui dès les années 1970 avaient entrepris de réunir et conserver des témoignages de leur métier et de leur milieu. Constitué essentiellement d’outils traditionnels de dockers, il s’agissait donc au départ d’un musée professionnel qui s’est enrichi et considérablement développé par la suite. Les collections initiales ont ainsi été complétées par les acquisitions du musée et les dépôts, principalement de la chambre de commerce de Dunkerque (iconographie) et du musée des Beaux-Arts de la ville (maquettes). 
Le musée est géré par l’association ACMAPOR qui fédère un multipartenariat institutionnel regroupant Dunkerque Grand Littoral, la ville de Dunkerque, la chambre de commerce et d'industrie, le grand port maritime de Dunkerque, l'Union maritime commerciale, le département du Nord, la région Nord-Pas-de-Calais et le ministère de la Culture, ainsi qu'un club d'entreprises comprenant quatre-vingt partenaires. Le musée portuaire est affilié à la Fédération des écomusées et musées de société et a obtenu la marque Qualité Tourisme en 2010.
Le président du conseil d'administration est Philippe Bertonèche, président du conseil de développement du grand port maritime de Dunkerque. Le musée est dirigé par Marie-Laure Griffaton, conservatrice, chef d'établissement et Delphine Grisot, secrétaire générale.",,3015532,,1,Wikipédia : Musée portuaire de Dunkerque,
Centre Historique Minier de Lewarde,,museum,nord,"[50.331895,3.17152799999997]",www.chm-lewarde.com,"Fosse Delloye, Rue d'Erchin, 59287 Lewarde","La fosse Delloye ou Joseph Delloye de la Compagnie des mines d'Aniche est un ancien charbonnage du Bassin minier du Nord-Pas-de-Calais, situé à Lewarde. Après treize ans de fermeture, le site est devenu le Centre historique minier de Lewarde. La fosse est commencée en 1911, à la même période que les fosses Bernard, Lemay et Bonnel. La fonçage du puits Delloye est interrompu par la Première Guerre mondiale. Les travaux ne reprennent qu'en 1921, et le puits est mis en service en 1927, lorsqu'il a atteint la profondeur de 360 mètres. À cette date, le puits Delloye no 2 est commencé à quelques décamètres au nord, et commence à extraire en 1932, un an après la mise en service de la fosse Barrois, la dernière des mines d'Aniche. Les puits assurent l'aérage, le service, et l'extraction.
La Compagnie des mines d'Aniche est nationalisée en 1946, et intègre le Groupe de Douai. Des cités de taille relativement modeste sont alors construites, la Compagnie d'Aniche n'en ayant pas bâti. La fosse Vuillemin est concentrée sur la fosse Delloye en 1955, ainsi que Sébastopol, son puits d'aérage. Des études sont menées sur le gisement, mais il s'avère que celui-ci n'est plus rentable à exploiter, la fosse ferme en 1971. À cette date, les seules fosses encore ouvertes sont celles appartenant aux concentrations Gayant et Barrois pour la concession d'Aniche, et no 9 de la concession de l'Escarpelle, en ce qui concerne le Groupe de Douai.
En 1973, les Houillères décident de créer un musée de la mine sous l'impulsion de Monsieur Alexis Detruys, Secrétaire Général du Bassin du Nord-Pas-de-Calais, et le site de la fosse Delloye est choisi. Le centre historique minier ouvre ses portes en 1984. La fosse Delloye constitue avec la fosse Arenberg, la fosse no 11 - 19 et la fosse no 9 - 9 bis, un des sites majeurs de la mémoire du bassin minier. D'autres fosses, plus modestes, ont également été conservées : la fosse no 6 des mines de Lens, la fosse no 13 bis des mines de Lens, la fosse no 2 des mines de Flines, et la fosse no 2 des mines de Marles. Au début du XXIe siècle, Charbonnages de France matérialise les têtes des puits Delloye nos 1 et 2, et y installe des exutoires de grisou. Outre la fosse, il subsiste également la base des terrils cavaliers nos 220 et 220A, et les cités, typiques de l'époque post-Nationalisation. En plus de présenter au public toutes les installations d'une fosse du XXe siècle, y compris des galeries reconstituées, le Centre historique minier possède également 2 700 mètres linéaires d'archives, parmi lesquelles on trouve 7 000 ouvrages, 550 000 documents photographiques, 500 films, 350 vidéogrammes et 300 enregistrements sonores. Le 21 septembre 2009, les installations de surface sont classées aux monuments historiques. La fosse Delloye a été inscrite le 30 juin 2012 au patrimoine mondial de l'Unesco.",,933871,,1,Wikipédia : Centre historique minier de Lewarde,
Carnaval de Dunkerque,,event,nord,"[51.0491406,2.38856409999994]",,59240 Dunkerque,"Le carnaval de Dunkerque est l’ensemble des festivités qui ont lieu dans l’agglomération dunkerquoise aux alentours de Mardi gras.
On distingue :	 

les bandes : les carnavaleux défilent dans les rues derrière la musique (la « clique »), conduite par un tambour-major.
les bals : les carnavaleux se retrouvent la nuit, dans les grandes salles de l'agglomération, pour faire la fête, en mêlant chansons carnavalesques et musique contemporaine, au profit d'associations (les corsaires…).C'est aussi à cette période que l'on peut entendre parler le patois dunkerquois de façon très appuyée.",,167198,,1,Wikipédia : Carnaval de Dunkerque,
Le Musée de Plein Air,,nature,nord,"[50.624272,3.18342299999995]",,"143 Rue Colbert, 59493 Villeneuve-d'Ascq",Le musée de plein air de Villeneuve-d'Ascq a pour but de valoriser le patrimoine architectural rural de l'ancienne région Nord-Pas-de-Calais.,,3778617,,1,Wikipédia : Musée de plein air de Villeneuve-d'Ascq,
Festival International de théâtre de rue,,event,auvergne,"[44.931079,2.444478]",www.aurillac.net,"20 Rue de la Coste, 15000 Aurillac","Le Festival international de théâtre de rue d'Aurillac (Cantal) a été créé en 1986 par Michel Crespin. Il a lieu dans les dernières semaines du mois d'août.
Considéré aujourd'hui comme un festival de référence à l'échelle nationale et internationale, il offre à ses visiteurs des centaines de spectacles en plein air le jour comme de nuit où la ville devient le lieu d'une grande fête au son de fanfares et batucadas et autres percussions endiablés.
L'atmosphère du festival est un mélange d'enchantement, de découverte et de libre expression aux coins de chaque rues, places et jardins publics.
De 1994 à 2018, le festival est dirigé par Jean-Marie Songy. Il est remplacé en 2019 par Frédéric Rémy. 
En amont du festival, dans le cadre des Préalables, des compagnies de la programmation officielle présentent leur spectacle dans certaines communes du département depuis 1999.",,128425,,1,Wikipédia : Festival international de théâtre de rue (Aurillac),
Parc Animalier de Sainte-Croix,Parc animalier de Sainte-Croix,museum,lorraine,"[48.7722776,6.89617420000002]",www.parcsaintecroix.com,"Route de Sainte-Croix, 57810 Rhodes","Le Parc animalier de Sainte-Croix est un parc zoologique français situé au cœur du parc naturel régional de Lorraine, à Rhodes. Principalement spécialisé dans la faune européenne, il est conçu comme un parc de vision. Créé en 1980 par Gérald Singer, ce sont maintenant ses fils, Laurent et Pierre, qui assurent la gestion du parc.
Couvrant une superficie de 120 hectares, il présente plus de 1 500 animaux de 130 espèces, à travers trois sentiers passant dans de grands espaces, notamment des cerfs, des ours, des lynx, des bisons, plusieurs meutes de loups, des vautours, mais aussi des lémuriens, des pandas roux et des gibbons à favoris roux.
Le parc animalier de Sainte-Croix dispose également d'une offre hôtelière de 22 hébergements insolites.
Le parc est membre du réseau des Grands sites de Moselle. Il a enregistré 325 239 entrées en 2016. Il fait partie des cinq zoos les plus vastes de France.","The Parc animalier de Sainte-Croix is a French Zoo specialised in European fauna, located inside the park parc naturel régional de Lorraine in Rhodes.
The Zoo was founded 1980 by Gérald Singer.",926374,52989039,1,Wikipédia : Parc animalier de Sainte-Croix,Wikipédia : Parc animalier de Sainte-Croix
Saint-Quirin,Saint-Quirin,city,lorraine,"[48.609772,7.06477199999995]",,57560 Saint-Quirin,"Saint-Quirin est une commune française située dans le département de la Moselle, en région Grand Est.
Cette commune se trouve dans la région historique de Lorraine et fait partie du pays de Sarrebourg.
Le village de Saint-Quirin, dont le nom dérive du nom latin Quirinus, appartenant à un tribun et saint martyr romain du IIe siècle, Quirin de Neuss, est cité pour la première fois dans un document en 966, bien que le site ait été occupé bien antérieurement, des vestiges gallo-romains (nécropole et divers objets) ayant en effet été mis au jour sur le territoire de la commune. Le village, qui fut pendant longtemps un important centre de pèlerinage, s’est développé autour d’un prieuré qu’y possédait l’abbaye de Marmoutier, lequel prieuré fut détruit lors de la guerre de Trente Ans, mais en partie reconstruit au XVIIIe siècle.
Ancien lieu de pèlerinage, le village est classé parmi les plus beaux villages de France.",Saint-Quirin (German: Sankt Quirin) is a commune in the Moselle department in Grand Est in north-eastern France.,309681,15691204,1,Wikipédia : Saint-Quirin,Wikipédia : Saint-Quirin
Vallée de Chaudefour,,nature,auvergne,"[45.561075,2.88958400000001]",,"Vallée de Chaudefour, 63790 Chambon-sur-Lac",La réserve naturelle nationale de la vallée de Chaudefour (RNN105) est une réserve naturelle nationale (RNN) située en Auvergne dans le Puy-de-Dôme. Elle fut créée en 1991 dans le Parc naturel régional des Volcans d'Auvergne et couvre une superficie de 820 hectares.,,3005964,,1,Wikipédia : Réserve naturelle nationale de la vallée de Chaudefour,
Château de Pesteils,,historical,auvergne,"[44.953486,2.57550000000003]",chateau-pesteils-cantal.com,15800 Polminhac,"Le château de Pesteils, ancienne Forteresse de Polminhac, est un château médiéval situé à Polminhac dans le Cantal. Le bâtiment est classé dans son ensemble au titre des monuments historiques depuis le 18 juillet 1994.",,3385615,,1,Wikipédia : Château de Pesteils,
Cité des sciences et de l'industrie,Cité des Sciences et de l'Industrie,museum,iledefrance,"[48.8955948,2.38789959999997]",www.cite-sciences.fr,"30 Avenue Corentin Cariou, 75019 Paris","La Cité des sciences et de l’industrie (CSI) est un établissement français spécialisé dans la diffusion de la culture scientifique et technique. Créée à l'initiative du président Valéry Giscard d'Estaing, elle a pour mission de diffuser à un large public, notamment aux enfants et aux adolescents, les connaissances scientifiques et techniques, ainsi que de susciter l'intérêt des citoyens pour les enjeux de société liés à la science, à la recherche et à l'industrie. L'ensemble est situé au niveau de la porte de la Villette, sur un emplacement occupé auparavant par les abattoirs de la Villette, dans le 19e arrondissement de Paris. Elle est au cœur d'un dispositif visant à valoriser la culture scientifique et technique : les Centres de culture scientifique, technique et industrielle (CCSTI). Avec la Cité de la musique et le Conservatoire national supérieur de musique et de danse de Paris, elle fait partie du parc de la Villette.
Le projet de réhabilitation des abattoirs, qui a pour vocation de les transformer en musée des sciences et techniques est confié le 15 septembre 1980 à Adrien Fainsilber. La structure en béton armé du projet inachevé de la grande salle des ventes des abattoirs a été partiellement conservée pour construire la Cité des sciences et de l'industrie, qui occupe trois des quatre travées du bâtiment inachevé, la quatrième travée étant inutilisée lors de l'inauguration. La superstructure métallique est construite par Baudin-Châteauneuf pour le treillis de toiture et par Viry pour la verrière du hall d'accueil. Complément du Palais de la découverte situé au Grand Palais, la Cité des sciences et de l'industrie ouvre ses portes le 13 mars 1986, inaugurée par François Mitterrand à l'occasion de la rencontre entre la sonde astronomique Giotto et la comète de Halley. En 2009, la Cité des sciences et le Palais de la découverte sont regroupés dans un établissement commun, nommé Universcience, au statut d’EPIC.","The Cité des Sciences et de l'Industrie (""City of Science and Industry"", abbreviated la CSI or simply CSI) is the biggest science museum in Europe. Located in Parc de la Villette in Paris, France, it is one of the three dozen French Cultural Centers of Science, Technology and Industry (CCSTI), promoting science and science culture.
About five million people visit the Cité each year. Attractions include a planetarium, a submarine (the Argonaute), an IMAX theatre (La Géode) and special areas for children and teenagers.
The Cité is classified as a public establishment of an industrial and commercial character, an establishment specialising in the fostering of scientific and technical culture. Created on the initiative of President Giscard d'Estaing, the goal of the Cité is to spread scientific and technical knowledge among the public, particularly for youth, and to promote public interest in science, research and industry.
The most notable features of the ""bioclimatic facade"" facing the park are Les Serres – three greenhouse spaces each 32 metres high, 32 metres wide and 8 metres deep. The facades of Les Serres were the first structural glass walls to be constructed without framing or supporting fins.
Between 30 May and 1 June 2008, the museum hosted the 3rd International Salon for Peace Initiatives.",133038,3419192,1,Wikipédia : Cité des sciences et de l'industrie,Wikipédia : Cité des Sciences et de l'Industrie
